State,Hospital Name,URL,Established,Construction Began,Opened,Current Status,Building Style,Architect(s),Alternate Names,Raw Text,Closed,Location,Architecture Style,Peak Patient Population
West Virginia,Barboursville State Hospital,https://www.asylumprojects.org/index.php?title=Barboursville_State_Hospital,1941,,"January 20, 1942",Active,Cottage Plan,,Barboursville Unit of the Weston State Hospital | Barboursville Unit of the Huntington State Hospital (1947) | Barboursville Veterans' Home,"In 1941, the State of West Virginia purchased 23.76 acres of land in the Cabell County town of Barboursville.  Part of that property included two buildings formerly dorms of Morris Harvey College, which had moved to Charleston in 1935 and would eventually become the University of Charleston.  It would take a year to recondition these buildings and install the necessary fixtures.  The hospital's original designation was the Barboursville Unit of the Weston State Hospital upon opening January 20, 1942.  By August 1st of that year the hospital had reached it's capacity of 270 patients.  The state soon made further renovations to accommodate 315 patients.
Renamed the Barboursville Unit of the Huntington State Hospital by the state legislature in 1947, Barboursville would also receive a new administration building and a new storage building.  Finally receiving its last name during the 1949 session of the state legislature, the hospital also was appropriated a separate laundry building and renovations for the existing structures.  These changes removed the last administrative functions from the dormitory buildings to the Admin Building, increasing the capacity once again to 402 beds.  In 1957 further funds were designated to construct a dormitory for male employees.[1]
Since 1981, it has been home to the West Virginia Veterans Home, a facility reserved specifically for veterans in need of a convenient and comfortable home. It is designed for individuals who are ambulatory and independent in all activities of daily living. It can house 150 veterans at full capacity and is operated by a staff of approximately 50 employees.
Dr. Charles Hamner, MD: Superintendent, ??? - 1960
Dr. Rosito P. Abellera, MD: Superintendent, early 1970s
Dr. Raymond H. Curry, MD: Physician, early 1960s
Dr. W.D. Bourn, MD: Physician, early 1960s
Mr. Bonafacio B. Gonzalez: Clinical director, 1961 - ???
Mr. John Queen: Business Manager, early 1960s",,"Barboursville, WV",,397 (1960 pop.)
West Virginia,Denmar Sanitarium,https://www.asylumprojects.org/index.php?title=Denmar_Sanitarium,1917,,1919,Active,Cottage Plan,,West Virginia Colored Tuberculosis Sanitarium | Denmar Correctional Center (current),"February 16, 1917, the legislature approved the establishment of a similar facility for African Americans. The West Virginia Board of Control purchased 185 acres of land and several buildings at Denmar in Pocahontas County from the Maryland Lumber Company. Denmar was chosen for it's high altitudes, which were beneficial to those with lung diseases. In January 1919, the West Virginia Colored Tuberculosis Sanitarium at Denmar admitted its first patients. However, the hospital accepted only those who could pay for their own care, creating hardships for many tuberculosis sufferers. Some patients arrived at the sanitariums by order of city or county governments, which were trying to contain the disease. The West Virginia Penitentiary also sent prisoners to the sanitariums to avoid infecting other inmates.
The number of patients at Denmar grew quickly and forced the state to add children's dormitories and a school . To alleviate overcrowding, the legislature funded a new building in 1937. Medical science gradually developed more effective means to diagnose and treat tuberculosis. In 1957, the state converted Denmar to a hospital for the chronically ill and moved the remaining tuberculosis patients to the newly integrated Hopemont facility. Between 1960 and 1961 Denmar saw it's population nearly double from 100 to 180.  In 1965, the Hopemont Sanitarium also became a hospital for the chronically ill but continued to admit tuberculosis patients.
The Denmar State Hospital closed in 1990 and was converted to a correctional facility in 1993. During the 1993 session of the West Virginia Legislature, funds were appropriated to the Division of Corrections for renovation and occupation of the facility now known as Denmar Correctional Center. In December 1998, the Regional Jail Authority provided funding for a building project at Denmar. The project included a Multi-Purpose Building, a Correctional Industries/Vocational Building and a new roof for the Greenbrier Birthing Center. The building project was completed in January of 2000.[1]",1990,"Denmar, WV",,180 (1961 pop.)
West Virginia,Hopemont State Hospital,https://www.asylumprojects.org/index.php?title=Hopemont_State_Hospital,1911,,1913,Active,Cottage Plan,,West Virginia State Tuberculosis Sanitarium  | Hopemont Sanitarium,"Hopemont is an unincorporated community in Preston County, West Virginia, United States. It is located to the east of Terra Alta and is the home of Hopemont State Hospital, originally created as the West Virginia State Tuberculosis Sanitarium, Hopemont accepted all ages of white Tuberculosis sufferers. According to the Geographic Names Information System, Hopemont has also been known as Rinards Crossing. Originally built to care for the state's citizens with tuberculosis. Hopemont has operated as a Medicaid certified long-term nursing facility since 1987.
The 600 acre tract owned by the state hospital provided land for the farm operated by many southern institutions into the 1970s.  In addition to four wards in the main hospital itself, Hopemont was also home to the Conley Hospital for maximum security inmates suffering from tuberculosis.  Two of the wards were set aside for children, with a capacity of fifty each and a qualified teacher to continue courses to the secondary level.
Today Hopemont Hospital provides services to geriatric residents of West Virginia requiring long-term care and behavioral interventions to maximize their functioning ability and independence, enabling them to become successful and satisfied in their environment. Hopemont, through lease space agreements, provides operation areas to Valley Community Mental Health for a Day Treatment Unit for Adults and United Summit Center for the John D. Good substance abuse unit.
Main Image Gallery: Hopemont State Hospital
In 1995 Warden Stephen Yardley and his staff at the Denmar Correctional Center compiled a list of 277 names of sanitarium patients believed to be buried on site. William P. McNeel and members of the Pocahontas County Historical Society scoured the county death records from 1923 to 1946 and made many corrections and additions to the original list. Staff at the West Virginia State Archives conducted a search of the state death records from 1919 to 1946 and discovered several hundred names that did not appear in either hospital or county records.
Vintage & historical photos of the hospital",,,,
West Virginia,Huntington State Hospital,https://www.asylumprojects.org/index.php?title=Huntington_State_Hospital,,1897,1901,Active,Cottage Plan,,Home for Incurables | West Virginia Asylum | Huntington Hospital | Mildred Mitchell-Bateman Hospital,"Huntington Hospital was created by an act of the legislature in 1897, making it the second oldest hospital in the State of West Virginia. When established, it was called the Home for Incurables; this was later changed to the Huntington State Hospital. On October 2, 1999, the name of the hospital was again changed to the Mildred Mitchell-Bateman Hospital.
In the 1950's, the hospital had a mixed population with a census of nearly 1,800; approximately one-third were developmentally disabled, and one-third were geriatric. The Hospital has gradually reduced its inpatient population; this reflects the national movement towards deinstitutionalization and community based pro- grams. This effort was greatly enhanced by the attention generated for mental health services through a class action suit resulting in the Hartley Consent Degree. In 1977, a complete reorganization of the hospital began with emphasis on specialization of direct care services. In 1978, an affiliation agreement was signed with the Marshall University School of Medicine - the first step toward developing Huntington Hospital's potential to become a teaching institution.
In 1988, this hospital became the first (state-operated) psychiatric hospital in West Virginia to be accredited by the Joint Commission on Accreditation of Healthcare Organizations.
In February 1990, the effort to reduce inpatient beds was completed with the closure of the units in Building 3 where long-term mentally ill patients were hospitalized. From this point, the hospital became a 90-bed facility.
In December 1990, initial certification for the hospital with the Health Care Financing Authority was granted.
The hospital has provided treatment, education and referral services for dually diagnosed mentally ill substance abuse patients (MICA) since January 1997.
Main Image Gallery: Huntington State Hospital",,"Huntington, WV",,"1,300 (1960 pop.)"
West Virginia,Lakin State Hospital,https://www.asylumprojects.org/index.php?title=Lakin_State_Hospital,1919,,1926,Closed,Rambling Plan,,Lakin State Hospital for the Colored Insane | Lakin Hospital (1970) | Lakin Hospital Nursing Home,"Founded by an act of the West Virginia Legislature in 1919, Lakin Hospital opened its doors on Feb. 1, 1926, with a purpose of, “the reception and treatment of blacks suffering from mental and nervous disorders.” The Lakin State Hospital was created under the same legislation proposed by T.G. Nutter, Harry Capehart and T.J. Coleman, three African American legislators that created several state-funded reform institutions for African Americans between 1919 and 1921, that also created the Lakin Industrial Home for Colored Boys across WV 62 from the hospital. The hospital, then named the ‘Lakin State Hospital for the Colored Insane,’ served patients from across the state. Although the institution’s original name reflected the era of segregation, it was a nontraditional facility with an all black staff, including administrators, and was one of what is believed to be only two all black mental health facilities east of the Mississippi River.
In 1950, Lakin was visited along with the Huntington State Hospital and Spencer State Hospital by Dr. William Freeman, sometimes called the ""Father of the American Lobotomy"".  During July and early August Dr. Freeman performed 228 lobotomies on patients at those facilities, including twenty 'very dangerous Negroes' at Lakin.[1]
In 1954, Lakin State Hospital began the process of integrating it's staff and patient population.  It also assumed the duty of district hospital for Jackson, Mason, Putnam, and Wood counties in West Virginia.  In 1960 the facilities consisted of two three story main buildings (separated by gender), a two story office building, cannery, a new office/dietary complex constructed in 1959, two staff dormitories, physician housing, and a short term treatment medical center.  Along with those buildings, there were six older buildings that had been renovated structures serving as laundry, workshops, and recreation hall.  By 1960 psychosurgical procedures were no longer practiced, replaced by group and recreational therapy and psychotherapy.[2]  However, the hospital did still offer electro-convulsive therapy and insulin coma therapy.[3]
It's use  as a mental hospital persisted into the late 1970s, until the State of West Virginia de-institutionalized mental healthcare. [4]  Today the former Lakin State Hospital property is still owned by the Department of Health the Lakin Nursing Home, while many of the older buildings constructed by the state have now been demolished. One of the hospital’s oldest existing buildings is the Office Building which remains on the grounds though it is only used for storage by the nearby Lakin Correctional Facility for Woman. The Office Building, erected around the late-1950’s is said to have housed not only offices but been a place for major and minor surgery and private pay patients. The Dietary Building which sits behind the Office Building was erected in 1958 and is still in use.[5]
In modern times, the state hospital is frequently confused with the Lakin Industrial Home for Colored Boys.  Proximity and similar names mean casual observers often mistook the abandoned Industrial Home building for being the state hospital.  Matters are not helped since after the School's closing in 1955 the State Hospital took over the grounds in 1957, using the structures as employee housing, post office, and gymnasium.[6]
Dr. M. Mitchell Bateman, MD: Superintendent, ???-1960
Dr. Kathryn A. Rainbow, MD: Superintendent, 1961-???
Mr. G.E. Chamberlain, jr: Business Manager, ???-1960
Mr. Lenzy G. Austin: Business Manager, 1961-???
Dr. Luther D. Robinson, MD: Staff physician, 1947-1949",late 1970s,"Lakin, WV",,502 (1960 pop.)
West Virginia,Spencer State Hospital,https://www.asylumprojects.org/index.php?title=Spencer_State_Hospital,,1893,,Demolished,Kirkbride Plan,,West Virginia Second Hospital for Insane,"In 1885, the state legislature began hearings on the need for a Second Hospital for the Insane. The first hospital for the insane was built at Weston in 1859. Because of overcrowded conditions, it was determined that a second facility was needed. They appointed a commission to choose several sites and present their findings at the next session in 1887. John G Schilling, a Spencer attorney, was among the members of the commission.
One of the factors that would determine the final selection of a site was the willingness of the county government to purchase the necessary land and donate it to the state free of charge. Roane County was enthusiastic with the prospect of obtaining the hospital. The Roane County Court immediately issued an order stating that they would indeed be willing to meet this requirement.
The decision on the hospital's location was not made until the legislative session of 1887. Spencer was eventually chosen as the site of the new hospital. The legislature approved an appropriation of $10,000 to begin construction. The county was now required to provide the land for the facility. On February 10, 1888, the county court purchased 184 acres of land from William R. Goff for the sum of $9,200. Goff, after receiving this large sum of money began looking for a safe repository for his money. Goff and several other citizens joined together to form the Bank of Spencer. It opened for business in March 1891. The county's first bank was designated to handle the funds for the construction of the new hospital. It also later handled the state hospital's regular transactions. The building was 1/4 mile in length. It was sometimes referred to as the longest continuous brick building in America. Bricks for the hospital's Gothic structure were made on the grounds. Native Roane County stone hand cut by Henry Waldeck and Lee Kelley was used for facings and adornments. The slate roof was adorned with cupolas which were typical of the period. The administration building stood four stories high and was topped with two round towers. On each side of the administration building were the two three-story wards, one for men and one for women. The building was completed in 1893 at a total cost of $93,393.
The state's Second Hospital for the Insane was opened on July 18, 1893. At the time of the opening, 54 patients were admitted to the new facility. By 1899 the number of patients had increased to 389 and by 1910 to 696. Some of the disorders patients were admitted for were alcoholic excess, overwork, senility, hereditary insanity, worry, ill health, head injuries, syphilis, epilepsy, paralysis, morphia, cocaine use, cholera, disease of the uterus, pneumonia, bereavement, typhoid fever, tuberculosis and childbed fever.
For the first ten years the open door system was used. No doors were locked and some doors were even removed. This system was considered a success. Even though this open door system was very successful a fence was erected around the hospital to separate the patients from the town. Many of the patients were able to work. They worked in the kitchen, laundry, sewing rooms, lawns, gardens and on the farm. The 15 acres of farm and woodlands were used for grazing of a fine dairy herd, fattening hogs, and raising poultry, as well as, supporting large gardens. The gardens produced enough to feed patients and staff during summer, with extra vegetables and canned goods for the winter.
In the early 1920's the name of the institution was changed to the Spencer State Hospital. In 1937 a five bed hospital clinic was added. By 1941, reports show that over 9,000 persons had been treated there. Many persons without families lived most of their lives in the institution and were buried in unmarked graves. Many of the patients were not mentally ill. Among those were elderly persons and unwanted children. In 1950, a staff of three doctors and 150 psychiatric aides were caring for 1,200 patients.
In the 1950's the number of employees increased. An assistant to the superintendent, social workers, a dietician, a psychologist, a psychiatrist, a registered nurse, and a beautician were added. An 85 bed clinic was constructed in 1952. A hospital library, the first and largest in a state institution, was built along with a women's dormitory.
In 1959 the employees began working eight hours a day and they no longer were required to pay a maintenance fee. Before 1959 they worked six days a week, 12 hours a day. They were paid $90 a month, from which a $50 maintenance fee for room, board, and uniforms were deducted, whether the employee lived on or off the grounds. About 1959, workers began to replace the structure's original slate roof with its cupolas and other ornaments with a flat roof. This radically altered the appearance of the hospital. The administration building was torn down and replaced with a modern administration and food service complex between 1973 and 1976. This also changed the view of the hospital greatly.
Spencer State Hospital's function had become provision of custodial care rather than serving its patients as a therapeutic treatment center. This situation would prove to be the seed of the facility's eventual destruction. For more than 30 years attempts were made to free the hospital to fulfill a treatment mission again. All attempts failed. Spencer State Hospital's late years saw the citizens of Roane County united in a battle to save the hospital, much as they united to bring the hospital to Roane County nearly a hundred years ago. In June 1989, the closure of Spencer State Hospital came quietly and an important chapter in the history of Roane County came to an end. The townspeople can no longer depend on the State Hospital whistle to remind them of lunch time and the end of the day. For the whistle is also silent.
Main Image Gallery: Spencer State Hospital
According to WPA information in 1940, Cemetery No. 1 had 750 unmarked graves, 7 marked. Cemetery No. 2 had 100 marked graves, none marked. Earliest stone dated 1902.",1989,,,"1,030 (1960 pop.)"
