State,Hospital Name,URL,Established,Construction Began,Opened,Current Status,Building Style,Architect(s),Alternate Names,Raw Text,Closed,Location,Architecture Style,Peak Patient Population
West Virginia,Weston State Hospital,https://www.asylumprojects.org/index.php?title=Weston_State_Hospital,,"March 22, 1858","October 22, 1859",Preserved,Kirkbride Plan,Richard Snowden Andrews,Trans-Allegheny Lunatic Asylum | West Virginia Hospital for the Insane,"From a 1916 Report by Henry Hurd:[1]
This was West Virginia's first public institution. Its construction was begun by the State of Virginia before the separation of West Virginia from the mother state, the first appropriation having been made by the Legislature of Virginia, March 22, 1858. The institution was opened October 22, 1859, when nine patients were brought from Ohio, where they had been in temporary care awaiting the completion of the hospital. Dr. R. Hills, formerly of the Central Ohio Insane Asylum, was made superintendent and Dr. N. B. Barnes, assistant.
In the first years of its history the institution was encompassed with many difficulties. Not only were there financial troubles, but Confederate soldiers in a raid appropriated the blankets belonging to the patients, and in a second raid a ward was destroyed. The people of Weston very generously came to the rescue and contributed their own blankets to fill the temporary needs, public acknowledgment of which was made by the superintendent in his report. In 1868 the population of the hospital was 40; since that date there has been a continual increase in the number of inmates, and a corresponding increase in the appropriation for running expenses, until at the present time the population of the institution is 1023.
The grounds belonging to the hospital contain about 335 acres, and front about 2000 feet on the West Fork River, opposite the town of Weston, and extend back to the north to a depth sufficient for this acreage. With the exception of the site on which the buildings are located, which extends back from the river about 800 feet, the land is very steep and entirely unsuitable for tillage. A very small portion of it is used for gardening, but in the main it is used for grazing.
There are two producing gas wells upon the property, supplying abundant gas for all the needs of the institution, which were discovered in an effort to secure water by boring deep wells. The water supply is something of a problem with this institution, because the only source of supply is the West Fork River. The recent erection of a very large reservoir upon a high point of the hill in the rear of the building has solved the question of storage. So much filtering is needed, however, that it is difficult to get the water entirely free from sediment. There are some shallow drilled wells upon the premises, which are of considerable value in times of drought.
The general hospital building consists of a central portion—the administration building with wings extending on either side north and south. The corridors connect all the wards with each other and with the central building. The main building, erected of native blue sandstone, is 1290 feet in length and 125 feet deep. The auxiliary buildings are of brick and are located in the rear of the main buildings.

In the rear of the main building are:
1. The Atkinson Building, erected in 1897, three stories in height, containing three wards, all used for male patients.
2. A three-story brick building, containing two wards, one for male colored patients, the other for female colored patients.
3. A laundry building, occupied by the laundry, with a plumbing shop and power plant in the basement.
4. An electric power house, a one-story brick building, containing the electric light machinery, ice plant and three cold storage rooms.
5. A patients' kitchen, 45 by 75 feet, equipped with the necessary outfit for the cooking, which must be done on a large scale for such an institution.
6. A sick patients' kitchen.
7. A bake shop, a one-story brick building, containing oven, dough mixer, engine and other necessary utensils.
8. A store room, a two-story brick building, the lower floor containing the main store room, clothes-cutting room and sewing room; the upper floor is used as an attendants' dining room, with kitchen attached. This building is in bad condition.
9. A morgue; the morgue is a stone building for the reception of the bodies of patients dying in the house.
10. A hose house; a small frame building containing all the hose and fire fighting apparatus.
11. Greenhouses
12. Barn; this is a frame structure; part of it is used for horses and the remainder for cows.


From Wikipedia:[2]
The hospital was authorized by the Virginia General Assembly in the early 1850s as the Trans-Allegheny Lunatic Asylum. Following consultations with Thomas Story Kirkbride, then-superintendent of the Pennsylvania Hospital for the Insane, a building in the Kirkbride Plan was designed in the Gothic Revival and Tudor Revival styles by Richard Snowden Andrews (1830-1903), an architect from Baltimore whose other commissions included the Maryland Governor's residence in Annapolis and the south wing of the U.S. Treasury building in Washington. Construction on the site, along the West Fork River opposite downtown Weston, began in late 1858. Work was initially conducted by prison laborers; a local newspaper in November of that year noted ""seven convict negroes"" as the first arrivals for work on the project. Skilled stonemasons were later brought in from Germany and Ireland.
Construction was interrupted by the outbreak of the American Civil War in 1861. Following its secession from the United States, the government of Virginia demanded the return of the hospital's unused construction funds for its defense; before this could occur, the 7th Ohio Volunteer Infantry seized the money from a local bank, delivering it to Wheeling, where it was put toward the establishment of the Reorganized Government of Virginia, which sided with the northern states during the war. The Reorganized Government appropriated money to resume construction in 1862; following the admission of West Virginia as a U.S. state in 1863, the hospital was renamed the West Virginia Hospital for the Insane. The first patients were admitted in October 1864, but construction continued into 1881. The 200-foot (61 m) central clock tower was completed in 1871, and separate rooms for black people were completed in 1873. The hospital was intended to be self-sufficient, and a farm, dairy, waterworks, and cemetery were located on its grounds, which ultimately reached 666 acres (266 ha) in area. A gas well was drilled on the grounds in 1902. Its name was again changed to Weston State Hospital in 1913.
Originally designed to house 250 patients in solitude, the hospital held 717 patients by 1880; 1,661 in 1938; over 1,800 in 1949; and, at its peak, 2,400 in the 1950s in overcrowded conditions. A 1938 report by a survey committee organized by a group of North American medical organizations found that the hospital housed ""epileptics, alcoholics, drug addicts and non-educable mental defectives"" among its population. A series of reports by The Charleston Gazette in 1949 found poor sanitation and insufficient furniture, lighting, and heating in much of the complex, while one wing, which had been rebuilt using Works Progress Administration funds following a 1935 fire started by a patient, was comparatively luxurious.
By the 1980s, the hospital had a reduced population due to changes in the treatment of mental illness. In 1986, then-Governor Arch Moore announced plans to build a new psychiatric facility elsewhere in the state and convert the Weston hospital to a prison. Ultimately the new facility, the William R. Sharpe Jr. Hospital, was built in Weston and the old Weston State Hospital was simply closed, in May 1994. The building and its grounds have since been mostly vacant, aside from local events such as fairs, church revivals, and tours. In 1999, all four floors of the interior of the building were damaged by several city and county police officers playing paintball, three of whom were dismissed over the incident.
Efforts toward adaptive reuse of the building have included proposals to convert the building into a Civil War Museum and a hotel and golf course complex. A non-profit 501(c)3 organization, the Weston Hospital Revitalization Committee, was formed in 2000 for the purpose of aiding in preservation of the building and finding appropriate tenants. Three small museums devoted to military history, toys, and mental health were opened on the first floor of the building in 2004, but were soon forced to close due to fire code violations.
The hospital was auctioned by the West Virginia Department of Health and Human Resources on August 29, 2007. Joe Jordan, an asbestos demolition contractor from Morgantown, was the high bidder and paid $1.5 million for the 242,000-square-foot (22,500 m2) building. Bidding started at $500,000. Joe Jordan has also begun maintenance projects on the former hospital grounds. In October 2007,a Fall Fest was held at the Weston State Hospital. Guided daytime tours were offered as well as a haunted hospital tour at night, a haunted hayride and a treasure hunt starting on the hospital front porch. Family hayrides, arts and crafts and local music were also offered.
Main Image Gallery: Weston State Hospital
There are three cemeteries that are currently on a hill behind the hospital, all of them used at different times. The first was used from 1858- 1900, the second, from 1901-1933, and the last from 1933- to the 1970s. None of the graves are marked.",May 1994,"Weston, WV","Gothic Revival, Tudor Revival",2400 est. (2300 in 1961)
West Virginia,Lakin Industrial Home for Colored Boys,https://www.asylumprojects.org/index.php?title=Lakin_Industrial_Home_for_Colored_Boys,1919,,1924,Demolished,Single Building,,Lakin Industrial School for Colored Boys,"The Lakin Industrial School for Colored Boys was founded by T.G. Nutter, Harry Capehart and T.J. Coleman, three African American legislators that created several state-funded reform institutions for blacks between 1919 and 1921. This led to several structures being constructed west of WV 62 in rural Mason county. It lies just north of Lakin State Hospital. The familiar red brick building, built in 1924, was constructed of fireproof materials and is very sturdy, was the first building to be erected. A gymnasium was built in the 1940's; several smaller structures followed soon after.
The Lakin Industrial School closed in 1956, only two years after the Brown versus Board of Education of Topeka, Kansas decision that led to the gradual desegregation of many public schools and colleges in West Virginia. Those who remained before its closure were transferred to the Industrial School at Pruntytown.
It was owned by the West Virginia Department of Health and Human Services, the same owners of Lakin State Hospital across the state road that slides between the two. In 1976, the property was transferred over to WV Department of Agriculture and operated as a state farm until the early 1990s. Today the property is owned by AEP. The original Lakin Industrial School and several surrounding buildings were torn down in November, 2006 to make room for AEP's River Operations.",1956,"Lakin, WV",,
West Virginia,State Industrial Home for Colored Girls,https://www.asylumprojects.org/index.php?title=State_Industrial_Home_for_Colored_Girls,,,1924,Demolished,Cottage Plan,,,"The State Industrial School for Colored Girls was built in 1924 on property owned by the WV Colored Children's Home.  The facility was the first in the state for African American girls.  Previously, delinquent girls of color were sent to the state industrial school at Salem.  However, this presented a problem, as at the time, white girls and black girls were required to be housed separately and attend classes at different times.  Fannie Cobb Carter, Charleston native, and graduate of Storer College, was the school's first Superintendent. However, Carter refused to accept her appointment until state officials removed the bars from the home’s windows.
In 1956, both the WV Colored Children's Home and the Industrial Home for Colored Girls were officially closed as a result of the groundbreaking Brown v. Board of Education court case, and many of the girls were transferred to other facilities in the state.  By 1961, the entire property was sold to Marshall University.  The Colored Children's Home was used as married student housing under the University Heights name, and the industrial school was used off and on for housing and other things.",1956,"Huntington, WV",,
West Virginia,West Virginia Industrial Home for Girls,https://www.asylumprojects.org/index.php?title=West_Virginia_Industrial_Home_for_Girls,,,1899,Active,Cottage Plan,,Industrial Home for Youth | Salem Correctional Center,"The Industrial Home for Youth opened in 1899 as the West Virginia Industrial Home for Girls. Young females were sentenced by the juvenile courts or justices of the peace for incorrigibility and immorality, and by the criminal courts for felonies. Males were sentenced to the Industrial Home for Boys in Pruntytown, which had opened in 1891.
The change in philosophy regarding youth incarceration, which began in the 1970s, led to population declines at the industrial homes. In 1983, the Industrial School for Boys closed, and the girls’ facility was re-designated as the Industrial Home for Youth. The boys from Pruntytown were moved to this institution.
In 2000, an $18 million expansion was completed at the Industrial Home for Youth, with separate wings for females, males, and sex offenders. The new building provided for greater security, in-house medical services, and treatment programs. Educational services were provided through the West Virginia Department of Education.
In 2013, the young offenders were transferred to other juvenile centers. The facility—now called Salem Correctional Center—will become a minimum- and medium-security prison for up to 400 men.",,"Salem, WV",,
West Virginia,West Virginia Industrial Home for Boys,https://www.asylumprojects.org/index.php?title=West_Virginia_Industrial_Home_for_Boys,,,1891,Re-purposed for adult inmates,Cottage Plan,,Pruntytown Correctional Center,"7574p20_medium
Pruntytown Correctional Center, located at Pruntytown near Grafton, is a minimum- and medium-custody facility for male inmates. Pruntytown Correctional Center was originally established as the Industrial School for Boys in 1891 and served as a male juvenile facility until 1983. Females were housed at the Industrial Home for Girls in Salem.
For generations of West Virginia youth, the name Pruntytown was synonymous with reform school. A court could commit a boy to Pruntytown, or parents could commit a boy whom they felt was out of their control by getting a judge or magistrate to issue an order. Boys as young as six to eight years old were once housed in the facility. In 1914, the legislature established a minimum age of 10. Originally stressing a military-style discipline, a program evolved that emphasized education, training, and farm work. By 1917, eight years of education were offered, providing a full grade-school education. Previously, the institution had offered schooling up to the fourth grade.
As racial segregation became more prevalent, the State Industrial School for Colored Boys opened at Lakin, Mason County, in 1922, and all of the black boys from Pruntytown were moved there. The Lakin school also served to ease overcrowding at Pruntytown, where the population had increased to more than 400. In 1956, Pruntytown was reintegrated when Lakin closed. A forestry camp at Davis also opened, with boys from Lakin and Pruntytown.
The philosophy of youth incarceration began changing in the 1970s. In West Virginia, decisions by the Supreme Court and the legislature stopped the commitment of children who had not committed specific crimes. As a result, the population declined from 250 in the 1970s to 52 boys who were transferred to the Industrial Home for Youth in Salem when Pruntytown closed.
The facility reopened in 1985, housing minimum custody adult male inmates whose primary work function was to renovate the center. Today, Pruntytown Correctional Center emphasizes work assignments and educational opportunities. Many of the inmates work off-grounds for other state and municipal agencies such as the Division of Highways and the city of Clarksburg.
The center was run as a coed facility from 1988 until 2007 when all females were transferred to the Lakin Correctional Center in Mason County. [1]",1983 (as a juvenile facility),"Grafton, WV",,
West Virginia,Creating Berkeley County Poorhouse,https://www.asylumprojects.org/index.php?title=Berkeley_County_Poorhouse&action=edit&redlink=1,,,,,,,,"You have followed a link to a page that does not exist yet.
To create the page, start typing in the box below (see the help page for more info).
If you are here by mistake, click your browser's back button.
Warning: You are not logged in. Your IP address will be publicly visible if you make any edits. If you log in or create an account, your edits will be attributed to your username, along with other benefits.
Please note that all contributions to Asylum Projects may be edited, altered, or removed by other contributors.
If you do not want your writing to be edited mercilessly, then do not submit it here.
You are also promising us that you wrote this yourself, or copied it from a public domain or similar free resource (see Asylum Projects:Copyrights for details).
Do not submit copyrighted work without permission!
To edit this page, please answer the question that appears below (more info):
In the navigation menu to the left what is the second word of the fourth link from the top?",,,,
West Virginia,Creating Gilmer County Poor Farm,https://www.asylumprojects.org/index.php?title=Gilmer_County_Poor_Farm&action=edit&redlink=1,,,,,,,,"You have followed a link to a page that does not exist yet.
To create the page, start typing in the box below (see the help page for more info).
If you are here by mistake, click your browser's back button.
Warning: You are not logged in. Your IP address will be publicly visible if you make any edits. If you log in or create an account, your edits will be attributed to your username, along with other benefits.
Please note that all contributions to Asylum Projects may be edited, altered, or removed by other contributors.
If you do not want your writing to be edited mercilessly, then do not submit it here.
You are also promising us that you wrote this yourself, or copied it from a public domain or similar free resource (see Asylum Projects:Copyrights for details).
Do not submit copyrighted work without permission!
To edit this page, please answer the question that appears below (more info):
In the locations menu to the left, what is the sixth country up from the bottom?",,,,
West Virginia,Creating Kanawha County Infirmary,https://www.asylumprojects.org/index.php?title=Kanawha_County_Infirmary&action=edit&redlink=1,,,,,,,,"You have followed a link to a page that does not exist yet.
To create the page, start typing in the box below (see the help page for more info).
If you are here by mistake, click your browser's back button.
Warning: You are not logged in. Your IP address will be publicly visible if you make any edits. If you log in or create an account, your edits will be attributed to your username, along with other benefits.
Please note that all contributions to Asylum Projects may be edited, altered, or removed by other contributors.
If you do not want your writing to be edited mercilessly, then do not submit it here.
You are also promising us that you wrote this yourself, or copied it from a public domain or similar free resource (see Asylum Projects:Copyrights for details).
Do not submit copyrighted work without permission!
To edit this page, please answer the question that appears below (more info):
In the locations menu to the left, what is the sixth country up from the bottom?",,,,
West Virginia,Creating Marshall County Infirmary,https://www.asylumprojects.org/index.php?title=Marshall_County_Infirmary&action=edit&redlink=1,,,,,,,,"You have followed a link to a page that does not exist yet.
To create the page, start typing in the box below (see the help page for more info).
If you are here by mistake, click your browser's back button.
Warning: You are not logged in. Your IP address will be publicly visible if you make any edits. If you log in or create an account, your edits will be attributed to your username, along with other benefits.
Please note that all contributions to Asylum Projects may be edited, altered, or removed by other contributors.
If you do not want your writing to be edited mercilessly, then do not submit it here.
You are also promising us that you wrote this yourself, or copied it from a public domain or similar free resource (see Asylum Projects:Copyrights for details).
Do not submit copyrighted work without permission!
To edit this page, please answer the question that appears below (more info):
What is the primary background color of the circle in our logo?",,,,
West Virginia,Creating Pendleton County Poor Farm,https://www.asylumprojects.org/index.php?title=Pendleton_County_Poor_Farm&action=edit&redlink=1,,,,,,,,"You have followed a link to a page that does not exist yet.
To create the page, start typing in the box below (see the help page for more info).
If you are here by mistake, click your browser's back button.
Warning: You are not logged in. Your IP address will be publicly visible if you make any edits. If you log in or create an account, your edits will be attributed to your username, along with other benefits.
Please note that all contributions to Asylum Projects may be edited, altered, or removed by other contributors.
If you do not want your writing to be edited mercilessly, then do not submit it here.
You are also promising us that you wrote this yourself, or copied it from a public domain or similar free resource (see Asylum Projects:Copyrights for details).
Do not submit copyrighted work without permission!
To edit this page, please answer the question that appears below (more info):
What is the primary background color of the circle in our logo?",,,,
West Virginia,Creating Tyler County Poor Farm,https://www.asylumprojects.org/index.php?title=Tyler_County_Poor_Farm&action=edit&redlink=1,,,,,,,,"You have followed a link to a page that does not exist yet.
To create the page, start typing in the box below (see the help page for more info).
If you are here by mistake, click your browser's back button.
Warning: You are not logged in. Your IP address will be publicly visible if you make any edits. If you log in or create an account, your edits will be attributed to your username, along with other benefits.
Please note that all contributions to Asylum Projects may be edited, altered, or removed by other contributors.
If you do not want your writing to be edited mercilessly, then do not submit it here.
You are also promising us that you wrote this yourself, or copied it from a public domain or similar free resource (see Asylum Projects:Copyrights for details).
Do not submit copyrighted work without permission!
To edit this page, please answer the question that appears below (more info):
In the navigation menu to the left what is the second word of the fourth link from the top?",,,,
West Virginia,Creating Wood County Poor Farm,https://www.asylumprojects.org/index.php?title=Wood_County_Poor_Farm&action=edit&redlink=1,,,,,,,,"You have followed a link to a page that does not exist yet.
To create the page, start typing in the box below (see the help page for more info).
If you are here by mistake, click your browser's back button.
Warning: You are not logged in. Your IP address will be publicly visible if you make any edits. If you log in or create an account, your edits will be attributed to your username, along with other benefits.
Please note that all contributions to Asylum Projects may be edited, altered, or removed by other contributors.
If you do not want your writing to be edited mercilessly, then do not submit it here.
You are also promising us that you wrote this yourself, or copied it from a public domain or similar free resource (see Asylum Projects:Copyrights for details).
Do not submit copyrighted work without permission!
To edit this page, please answer the question that appears below (more info):
In the toolbox menu to the left what is the second word in the third link from top?",,,,
West Virginia,Fairmont Emergency Hospital,https://www.asylumprojects.org/index.php?title=Fairmont_Emergency_Hospital,1899,1899,October 1900,Demolished,Single Building,,Miner's Hospital No. 3  |  Fairmont State Hospital,"Established in 1899 for the purpose of treating persons injured in mining accidents, by 1960 the hospital had evolved into the Fairmont Emergency Hospital; the primary source of patrons was other West Virginia state institutions.  Included were the Industrial School for Boys at Prunytown, the Industrial School for Girls at Salem, the West Virginia Training School at St. Marys, the Children's Home at Elkins, Huttonsville State Prison, Spencer State Hospital, Weston State Hospital, Barboursville State Hospital, Lakin State Hospital, and the Forestry Camp at Davis.  There was no charge for these cases, though the hospital did accept some paying maternity and surgical cases.  In 1960 the hospital was still operating at a profit under Superintendent Dr. Carl J. Carter, MD, FACS and business manager Donlay T. Schultz.  Not to be mistaken for Fairmont General Hospital, a public hospital that began operation as Cook's Hospital.",1980,"Fairmont, West Virginia",,68 (1960)
