State,Hospital Name,URL,Established,Construction Began,Opened,Current Status,Building Style,Architect(s),Alternate Names,Raw Text,Closed,Location,Architecture Style,Peak Patient Population
South Carolina,Creating Anderson-Oconee-Pickens Mental Health Center,https://www.asylumprojects.org/index.php?title=Anderson-Oconee-Pickens_Mental_Health_Center&action=edit&redlink=1,,,,,,,,"You have followed a link to a page that does not exist yet.
To create the page, start typing in the box below (see the help page for more info).
If you are here by mistake, click your browser's back button.
Warning: You are not logged in. Your IP address will be publicly visible if you make any edits. If you log in or create an account, your edits will be attributed to your username, along with other benefits.
Please note that all contributions to Asylum Projects may be edited, altered, or removed by other contributors.
If you do not want your writing to be edited mercilessly, then do not submit it here.
You are also promising us that you wrote this yourself, or copied it from a public domain or similar free resource (see Asylum Projects:Copyrights for details).
Do not submit copyrighted work without permission!
To edit this page, please answer the question that appears below (more info):
In the popular pages menu to the left, what is the word the follows Website?",,,,
South Carolina,G. Werber Bryan Psychiatric Hospital,https://www.asylumprojects.org/index.php?title=G._Werber_Bryan_Psychiatric_Hospital,,,1978,Active,Cottage Plan,,,"Bryan Psychiatric Hospital is licensed by the state of South Carolina as a Specialized Hospital and is accredited by The Joint Commission. Bryan Hospital provides inpatient psychiatric services to adults. Patients in the hospital's Civil Division are admitted primarily from the 33 counties comprising the Midlands region, the Pee Dee region and the Low Country region of South Carolina. The majority of patients treated in the Adult Services Division are involuntary admissions. Patients in the hospital's Forensics Division are primarily referred by jails and criminal courts from throughout the state, and are housed separately from patients in the Adult Services Division in a more secure area of the hospital. This facility is located on property next to the former Palmetto State Hospital.",,"Columbia, SC",,
South Carolina,Gilliam Psychiatric Hospital,https://www.asylumprojects.org/index.php?title=Gilliam_Psychiatric_Hospital,,,1984,Active,Cottage Plan,,,"Gilliam Psychiatric Hospital (GPH) is an eighty-seven (87) bed, single-celled, licensed psychiatric hospital, which serves as the South Carolina Department of Correction's (SCDC's) inpatient psychiatric care facility for the male inmate population. GPH is located at SCDC's Kirkland Reception and Evaluation Center in Columbia, South Carolina. Gilliam's mission is to provide twenty-four (24) hour psychiatric care and monitoring of its mentally ill inmates. This care includes psychiatric evaluations, psychological evaluation, group therapy, individual therapy, case management, medication management, and discharge planning. GPH also provides services to individuals who manifest symptoms of severe psychiatric disorders that require acute care, complex treatment management, or stabilization prior to referral to another level of care. It may also house individuals who exhibit chronic treatment needs that cannot be managed better at an alternate level of care. In addition, GPH also houses a small cadre of inmate workers who are non-mentally ill inmates that assist in housekeeping, food service, cleaning, and clerical support (prepare daily rosters, etc.). These inmates earn work credits for the jobs they perform at GPH.",,"Columbia, SC",,
South Carolina,Palmetto State Hospital,https://www.asylumprojects.org/index.php?title=Palmetto_State_Hospital,1910,,1913,Active,Cottage Plan,,Crafts-Farrow State Hospital |  Manning Correctional Institution (Current),"In 1910, after years of legislative debate, South Carolina finally approved funding to purchase land for an annex to house African American patients. Development of the State Park site moved slowly and was plagued with building and funding problems. The first African American patients were moved to the State Park division in 1914. The monthly superintendent’s report from 1915 underscores the impact of the niacin deficiency disease, pellagra, on admissions to the state hospital, especially among African American patients. Pellagra was the leading cause of discharge by death for African Americans patients.
South Carolina appears to have instituted social services fairly early in its operations, The June 1924 monthly report provides a summary of the work of field worker, Ethel Sharpe. She provided pre-and post-discharge community visits, special investigations, social histories and follow-up work for clinicians. In that month, she provided these services to 98 patients, of whom only 3 were African American. This racially disparate trend continued for some time. Community visits were a crucial step toward discharge from the hospital, so it is not surprising that it may have been more difficult for African American patients to secure their return to their communities. As could be expected, conditions at the State Farm site continued to deteriorate with frequent complaints regarding patient care and employee rights. In 1963, the State Park site was reorganized as a separate entity and renamed Palmetto State Hospital. The stated reason for the change was a move toward a decentralized regional system. The primary benefit of the move was to facilitate the improvement of the white facility in order to qualify for Joint Commission on Accreditation of Healthcare Organizations certification and retain its residency program.
South Carolina eventually developed an acceptable plan, which included the opening of an integrated admissions building at the Columbia facility in February 1966. In 1996, the State Hospital and Crafts-Farrow State Hospital consolidated their services and moved patients from Crafts-Farrow to the State Hospital campus, which resulted in the organization of the Division of Psychiatric Rehabilitation Services.  As of 2001, CFSH is the site of the Intermediate Care Facility for the treatment of patients with the dual diagnosis of mental illness and mental retardation.  This program is operated in cooperation with the Department of Disabilities and Special Needs.",1996,,,
South Carolina,Patrick B. Harris Psychiatric Hospital,https://www.asylumprojects.org/index.php?title=Patrick_B._Harris_Psychiatric_Hospital,,,1985,Active,Single Building,,,"Patrick B. Harris Psychiatric Hospital is a 200 bed, regional acute care inpatient facility of the South Carolina Department of Mental Health (SCDMH) which serves 13 counties of the upstate of South Carolina.  The hospital  provides intensive, short-term, psychiatric diagnostic and treatment services on a 24 hour, emergency voluntary and involuntary basis.  The SCDMH mental health centers screen admissions and are actively involved in discharge planning.",,"Anderson, SC",,
South Carolina,Creating Richland Springs Psychiatric Hospital,https://www.asylumprojects.org/index.php?title=Richland_Springs_Psychiatric_Hospital&action=edit&redlink=1,,,,,,,,"You have followed a link to a page that does not exist yet.
To create the page, start typing in the box below (see the help page for more info).
If you are here by mistake, click your browser's back button.
Warning: You are not logged in. Your IP address will be publicly visible if you make any edits. If you log in or create an account, your edits will be attributed to your username, along with other benefits.
Please note that all contributions to Asylum Projects may be edited, altered, or removed by other contributors.
If you do not want your writing to be edited mercilessly, then do not submit it here.
You are also promising us that you wrote this yourself, or copied it from a public domain or similar free resource (see Asylum Projects:Copyrights for details).
Do not submit copyrighted work without permission!
To edit this page, please answer the question that appears below (more info):
What is the second word in our logo?",,,,
