State,Hospital Name,URL,Established,Construction Began,Opened,Current Status,Building Style,Architect(s),Alternate Names,Raw Text,Closed,Location,Architecture Style,Peak Patient Population
New York,Livingston County House,https://www.asylumprojects.org/index.php?title=Livingston_County_House,1829,,,Active,,,Livingston County Poorhouse,"The Livingston County House was established in 1829. The first Livingston County poorhouse is believed to have been located on the south side of Route 20a. Gradually as the population of the county increased, the original poorhouse became inadequate to accommodate the growing number of impoverished residents.”[1] This establishment has been around for nearly 195 years. Throughout the years this place has had multiple transitions. Originally, Livingston was used for housing for the elderly, orphans, the mentally ill individuals, and for anyone who was not able to work. The building, Livingston, was structured in different sections. On the lower level there was an education section and a wash hose and shoe shop. Then, on the next floor above there was an asylum for women who dealt with mental illness.
Throughout the lifetime of Livingston, it held a cemetery of hundreds of deceased people, of whom mainly had unmarked graves, until a law was passed that made marking graves as a requirement. During 1868 there was a fire that occurred in the poor house. The building completely burned down. After the fire Livingston continued to expand their farmland, which produced “livestock, crops, and fruit trees.[2] By 1925, Livingston was producing eggs and butter for sale. Livingston continued to grow and thrive as they increased their acres of farmland. In 1989, “The three brick buildings were sold and the center building was remodeled to operate as the Oak Valley Inn”[3]",,"4222 Lakeville Rd, Geneseo, NY 14454, USA",,
New York,Madison County Poor House,https://www.asylumprojects.org/index.php?title=Madison_County_Poor_House,,,,,,,,"1864 Madison County Poor House
“The statistics from Madison county reveal a most deplorable condition of the insane poor. It is shocking, it is shameful.
The poor house contains ninety-four paupers, twenty-five of whom are insane. They are, with three exceptions, of American birth. The records of the institution do not show the dates of their admission. Inspection shows that fifteen of this number are filthy in their habits, and that only five have ever been treated in an asylum. Nine are capable of doing some labor. The remainder have nothing to do; fourteen are destructive to their clothing. The house has no bathing tub, the insane are not even required to bathe at all, and the violent insane not even to wash their hands and face. It is idle to describe the building, it is heart-sickening to describe what is in it. Eighteen sleep on straw, without bed or bedding; the straw is changed once a week. The food is distributed in tin dishes. No uniformity of heat in winter seems to be aimed at. The mild cases have their liberty during the day. Not so the violent. The only care they receive is from the hands of incompetent paupers. Those confined in the cells are extremely filthy, most of them not using vessels, and their excrements are mixed with the straw on which they lie. Their straw is changed only once in a week; and these lunatics, with their “bodies besmeared with their own excrements, not allowed to come daily to the open air, eating in the same filthy apartments, are not washed from one years end to another.” The cells in which they are confined are only 4 x 6 feet, with a ceiling of 7 feet, and open into a hall, so that they can have no ventilation. “A bad stench” issues from them; and in this stench the lunatics are forced to live—live a life more terrible than a hundred deaths. Three males were in a state of nudity; the females wore only chemises; but the mild cases are clothed like other paupers. Fourteen had neither shoes nor stockings during the winter!!
This vile prison is designed to make confirmed maniacs of twenty-five persons; that is, it pretends to have accommodations for twenty-five, and their treatment would only serve to make them incurable. The books do not show what is the greatest number confined there at any one time. They are not visited by a physician, and receive no care with reference to their ultimate recovery.
Cannot the voice of humanity be awakened? Shall not legislative authority be exercised for their relief?”
SOURCE: Documents of the Assembly Of The State Of New York, Eighty-Eighth Session, 1865, Volume 6, Nos. 199 to 112 Inclusive, Albany: C. Wendell, Legislative Printer, 1865, Pages 199-200.
New York State County Poor Houses.",,,,
New York,Monroe County Poor House,https://www.asylumprojects.org/index.php?title=Monroe_County_Poor_House,1826,,1827/1931,Preserved,Single Building,Siegmund Firestone,Monroe County Almshouse | Monroe County Home & Infirmary | Monroe Community Hospital for the Care of the Chronically Ill | Monroe Community Hospital (Current),"The Monroe County Poor-House, situated three miles southeast from Rochester, was erected by the county in 1826. It was constructed of brick, and was calculated to accommodate from seventy-five to one hundred paupers. It was managed by five superintendents, and had, in 1827, thirty-five occupants, about twenty of whom were employed in useful labor. Population increased, and the building became old and overcrowded. The raving maniac, the young child, the infirm old man, and the seducer’s victim, were crowded in a building whose
remembrance must seem painful. Humanity called for a removal of the child from baneful influences, and a separation of the insane from the sane. In 1855 a school was taught by Miss Benedict, and contained some forty scholars. A schoolhouse was finished in 1859. It contained two stories, the lower being for a schoolroom, the upper for a dormitory.
In 1860 a building was set apart for the infirm old men. Year after year the buildings became more dilapidated, and the report in favor of new buildings passed unheeded until early in 1872, when the commissioners began to act in a manner which set the future at rest upon this question. The almshouse was located midway between the insane asylum and the penitentiary, and fifty feet south. By 1862 the number of patients admitted to the Asylum necessitated the erection of a separate building.
By 1929 concerns with overcrowding and fire safety at the Almshouse prompted the County to review the future of the building. County officials commissioned Siegmund Firestone, a notable Rochester architect and engineer, to investigate the current situation and to recommend a plan for its future. It was Mr. Firestone who made the recommendation that the County consider building a new facility better suited to care for the growing number of long-term and chronic care patients and to move the building’s location to East Henrietta Road. The County accepted his plan, and Firestone was hired to design and oversee the construction of this new facility.
Construction of the building that we now know as Monroe Community Hospital began in 1931, in the midst of the nation’s Great Depression. Mr. Firestone incorporated many innovative ideas into his design of the building and ensured that the project employed all local contractors. Mr. Firestone also hired a talented young architectural student and draftsman Thomas Boyde, Jr. as one of his assistants, and Boyde then became the first African-American architect in the community. Following nearly three years of construction and at a cost of $4 million, the new facility opened as the Monroe Community Home and Infirmary on August 1, 1933. The innovations in interior design as well as the beautiful, ornate exterior earned national recognition. The building was heralded as a model health care facility, and one publication called it “the most efficient installation of its kind anywhere.” It set new standards for hospital design, balancing the intertwined medical, psychological, and social needs of its residents with the need for efficient, cost-effective care.
From the 1930s through the 1950s, Monroe County Home and Infirmary functioned as a general hospital, providing medical, surgical, maternity, pediatric, and dental services for the indigent. In 1967, the County changed the facility’s name to the Monroe Community Hospital for the Care of the Chronically Ill. The name change reflected a shift to address the rising population of elderly in the community. At that time, Monroe County also entered into an agreement with the University of Rochester School of Medicine and Dentistry to provide medical personnel and services, improving upon the quality and continuity of patient care.
The population that MCH serves today, however, has changed significantly from its early days. MCH now provides long-term care and rehabilitation for residents of all ages, from eight-week old infants to centenarians. Nearly three-quarters of the residents at MCH use wheelchairs, and the majority have complex medical and psychological needs requiring extensive medical and nursing care.",,"Rochester, NY",,
New York,Creating Montgomery County House,https://www.asylumprojects.org/index.php?title=Montgomery_County_House&action=edit&redlink=1,,,,,,,,"You have followed a link to a page that does not exist yet.
To create the page, start typing in the box below (see the help page for more info).
If you are here by mistake, click your browser's back button.
Warning: You are not logged in. Your IP address will be publicly visible if you make any edits. If you log in or create an account, your edits will be attributed to your username, along with other benefits.
Please note that all contributions to Asylum Projects may be edited, altered, or removed by other contributors.
If you do not want your writing to be edited mercilessly, then do not submit it here.
You are also promising us that you wrote this yourself, or copied it from a public domain or similar free resource (see Asylum Projects:Copyrights for details).
Do not submit copyrighted work without permission!
To edit this page, please answer the question that appears below (more info):
In the popular pages menu to the left, what is the word the follows Website?",,,,
New York,Niagara County Poor House,https://www.asylumprojects.org/index.php?title=Niagara_County_Poor_House,,,,,,,,,,,,
New York,Rome State Custodial Asylum,https://www.asylumprojects.org/index.php?title=Oneida_County_Alms_House,1827,1893,,Closed,Cottage Plan,,"Oneida County Alms house, | Rome State Custodial Asylum for Unteachable Idiots, | Rome State School, | Rome Developmental Center, | Onieda Correctional Facility","Opened in 1827 as the Oneida County Poorhouse, The Rome State Custodial Asylum began as a 2 story building on the outskirts of Lynchville to house paupers and the insane.  In 1893 the school shifted toward assisting the ""unteachable mental defectives"" as well as housing those patients it was already chartered to house and changed name to the Oneida State Custodial Asylum.  In 1984 the school again changed name to the Rome State Custodial School and was developed into a ""colonial system"" designed around teaching job skills via labor at off site ""colonies"".  Rome reached a peak population in 1960 of 5,166.  The last resident of the facility left in October 1989 and the facility closed in November of that year. More history and pictures can be found here [1][2][3][4]
Main Image Gallery: Rome State Custodial Asylum
This cemetery is located behind the old Rome Developmental Center near the intersection of Rte. 365 and 26S in the City of Rome. This was the burial site of residents of the Rome Developmental Center and this monument was erected in their memory. There are no tombstones.",1989/2011,"Rome, NY",Queen Anne & Gothic Revival,"5,166 in 1960"
New York,Onondaga County Poor House,https://www.asylumprojects.org/index.php?title=Onondaga_County_Poor_House,,,1827,Closed,Cottage Planned,,Onondaga County Poor House | Onondaga County Poor Farm | Onondaga County Home & Infirmary | Van Duyn Home & Hospital | Van Duyn | Onondaga Community College,"During most of the 1800s, the Poor House and its attached asylum for the mentally ill packed together a broad assortment of individuals.  Most were simply poor and did not have the personal or family means for care.
They suffered from a stunning variety of social ills; an 1977 report listed: Alcoholism, Vagrancy, Destitute, Lunacy, Sickness, Old Age, Debauchery Bastardy, Blindness, Lameness, Idiocy,.  Many were undereducated and poor from birth.  Others had once been successful citizens, but fell on hard times.  One 1871 report mentioned a young Civil War veteran residing in the ""insane department,"" whose case today would be classified as severe post-traumatic stress disorder.
Throughout the 19th century, society debated how to hand all these ills.  Some citizens blamed individual moral weirdness and wanted to limit public expense, satisfied with simply locking such individuals out of sight.  Others saw a need for better, specialized facilities and more targeted social programs.
Poor House admissions often depended on political connections and the quality of staffing could vary from sensitive to uncaring to occasionally brutal.  Pressed by local newspaper reports, reformers and state legislation, county leaders would commit to major improvements during the next century.
The first building on the grounds was a simple limestone structure that opened in 1827.  It sufficed for a time, but in the early 1850's, increasing immigration from Europe and the rapid growth of Syracuse's population brought about considerable crowding.  An average of 200 individual were houses at a time in a facility intended for no more than 150.
In 1854 a major addition was built, but an 1857 state report criticized the compound's inadequate care of the 16 residents labeled as ""lunatics.""  New additions were built for the mentally ill in the 1860s.  But the county facility was never properly staffed of designed for such specialized care.  By 1893, all mental patients had been transferred to state hospitals.
But by the start of the 20th century, with the county population nearing 200,000, the four 19th century buildings were increasingly seen as inadequate.
By 1900, the Poor House, now known as County Home, no longer had to care for the blind, those with mental illness or for children.  But it faced a growing number of occupants, especially as Syracuse's population soared toward 20,000.  And there were always sick, frail and even pregnant residents.  Various rooms were designated over time as infirmary wards but always proved deficient.  Pressed by local physicians and the state, the country finally relented and erected a 60-bed hospital for the site in 1900.  It marked a key transformation in the history of ""The Home"" and of local public care for the indigent.
By 1907, despite the new hospital, the only buildings regularly housing residents were more than 50 years old, greatly crowded, shared by both sexes, and viewed by the state as dangerous firetraps.  The country responded by building a separate new Women's Dormitory in 1908 and thren a ""fireproof"" brick addition for men in 1915.  The latter was attacked to the exisiting row of stone buildings.  The hospital, undersized from the outset, was expanded with the 1928 construction of an additional building (Now known as OCC's H-1 hall), which increased bed capacity to over 100.
The Great Depression pushed the unemployment to nearly 25%.  By 1931, the Home was housing 738 residents in a space meant for 500. Portions of the stone buildings, over 100 years old, were crowded and fire hazards.  Most were replaced by 1932 with a new men's dormitory, providing needed construction jobs for the community.
By the decade's end, the creation of new federal social welfare programs allowed more of the able-bodied poor to maintain their own, independent housing.
The Home's population increasingly tended to be infirm residents, requiring more medical assistance then just housing.  By the late 1950s, it was functioning primarily as a nursing home and hospital.  Its purpose was evolving into one of extended care and rehabilitation.
The Home took over a nearby, former tuberculosis sanitarium in 1950 to secure better hospital facilities, while retaining its original location.  County officials soon realized however, that increasing state and federal regulations made the motley assemblage of buildings composing the new renamed Van Duyn Home & Hospital unsuitable for the future.
In 1974 the county decided to build a single, 524-bed facility on the sanitarium grounds.  The present Van Duyn opened in 1979 and all patients were transferred there.  For the first time since 1827, the former Poor House grounds and buildings stood empty.  [1]
Today, the Onondaga Community College now occupies most of what had been the Poor House property.  The center of the college lies in what had been the poor house farm.  While the majority of the buildings of the original poor house has been torn down, the hospital extension and the women's dormitory was rebuilt by OCC and is now being used as new lecture halls.",1978 (The original grounds),Onondaga NY,,
New York,Creating Ontario County Poor House,https://www.asylumprojects.org/index.php?title=Ontario_County_Poor_House&action=edit&redlink=1,,,,,,,,"You have followed a link to a page that does not exist yet.
To create the page, start typing in the box below (see the help page for more info).
If you are here by mistake, click your browser's back button.
Warning: You are not logged in. Your IP address will be publicly visible if you make any edits. If you log in or create an account, your edits will be attributed to your username, along with other benefits.
Please note that all contributions to Asylum Projects may be edited, altered, or removed by other contributors.
If you do not want your writing to be edited mercilessly, then do not submit it here.
You are also promising us that you wrote this yourself, or copied it from a public domain or similar free resource (see Asylum Projects:Copyrights for details).
Do not submit copyrighted work without permission!
To edit this page, please answer the question that appears below (more info):
In the navigation menu to the left what is the second word of the fourth link from the top?",,,,
New York,Creating Orange County Poorhouses,https://www.asylumprojects.org/index.php?title=Orange_County_Poorhouses&action=edit&redlink=1,,,,,,,,"You have followed a link to a page that does not exist yet.
To create the page, start typing in the box below (see the help page for more info).
If you are here by mistake, click your browser's back button.
Warning: You are not logged in. Your IP address will be publicly visible if you make any edits. If you log in or create an account, your edits will be attributed to your username, along with other benefits.
Please note that all contributions to Asylum Projects may be edited, altered, or removed by other contributors.
If you do not want your writing to be edited mercilessly, then do not submit it here.
You are also promising us that you wrote this yourself, or copied it from a public domain or similar free resource (see Asylum Projects:Copyrights for details).
Do not submit copyrighted work without permission!
To edit this page, please answer the question that appears below (more info):
In the navigation menu to the left what is the second word of the fourth link from the top?",,,,
New York,Orleans County Poor House,https://www.asylumprojects.org/index.php?title=Orleans_County_Poor_House,,1876,,,,,,"The Orleans County poorhouse was located on West County House Road in the town of Albion. It was a three-story building built in 1876. It accommodated 140 people. It also had living quarters for the caretakers and supervisors who lived on site. The poor houses supervisor was Journal E. Salisbury, his salary for this position was $1,300. It was an elected position.  It was considered a great service to care for these people. Today there is a cemetery to commemorate the people that lived and died in the workhouse.",,,,
New York,Creating Oswego City Poor House,https://www.asylumprojects.org/index.php?title=Oswego_City_Poor_House&action=edit&redlink=1,,,,,,,,"You have followed a link to a page that does not exist yet.
To create the page, start typing in the box below (see the help page for more info).
If you are here by mistake, click your browser's back button.
Warning: You are not logged in. Your IP address will be publicly visible if you make any edits. If you log in or create an account, your edits will be attributed to your username, along with other benefits.
Please note that all contributions to Asylum Projects may be edited, altered, or removed by other contributors.
If you do not want your writing to be edited mercilessly, then do not submit it here.
You are also promising us that you wrote this yourself, or copied it from a public domain or similar free resource (see Asylum Projects:Copyrights for details).
Do not submit copyrighted work without permission!
To edit this page, please answer the question that appears below (more info):
What is the primary background color of the circle in our logo?",,,,
New York,Creating Otsego County Poor House,https://www.asylumprojects.org/index.php?title=Otsego_County_Poor_House&action=edit&redlink=1,,,,,,,,"You have followed a link to a page that does not exist yet.
To create the page, start typing in the box below (see the help page for more info).
If you are here by mistake, click your browser's back button.
Warning: You are not logged in. Your IP address will be publicly visible if you make any edits. If you log in or create an account, your edits will be attributed to your username, along with other benefits.
Please note that all contributions to Asylum Projects may be edited, altered, or removed by other contributors.
If you do not want your writing to be edited mercilessly, then do not submit it here.
You are also promising us that you wrote this yourself, or copied it from a public domain or similar free resource (see Asylum Projects:Copyrights for details).
Do not submit copyrighted work without permission!
To edit this page, please answer the question that appears below (more info):
In the popular pages menu to the left, what is the word the follows Website?",,,,
New York,Putnam County Poor House,https://www.asylumprojects.org/index.php?title=Putnam_County_Poor_House,,,1894,,,,,"The Putnam County Poor House was open from 1894-1961. The poor house and farm laid across 150 acres of land located on Country Farm Road. It had barns and buildings that not only housed the inmates, but housed the manager and his family at the time. There was no electricity on the farms, and for water, they had to use a hydraulic ram. Some of the jobs that were done there included wheat thrashing and butchering animals for materials. Eventually a screen room was added by Oakley and Lawrence Chaffin to confine mentally disturbed people. Life in any poor house was not great and people died on the farms and in the poor house. It was common enough that they had homemade coffins and when someone passed, they would take them to the cemetery on the farm and bury them. This land now, has been cultivated and the cemetery no longer is there.
Aside from the structure of the farm, it was controlled by the County Court which was made up of one justice of the peace from each district. The justice of the peace is now known as the County Commissioner. At one point in the history of the poor house, someone named Bill Rippletoe was the manager. During his time there, a little boy showed up at the farm looking to work there. Rippletoe and his wife felt so bad that they ended up adopting the boy. Alvin Palk was another manager, after Rippletoe who left the farm and came back until the early nineteen fifties. Then, the county court decided to close the county home and move the patients into a nursing home. After these patients were moved, Putnam County hired a county health doctor to check out the people that were at the county home and to vaccinate the school children of the county. After the county home finally closed, Willow Avenue Church of Christ leased the property for Happy Haven Home for children. [1]",1961,,,
