State,Hospital Name,URL,Established,Construction Began,Opened,Current Status,Building Style,Architect(s),Alternate Names,Raw Text,Closed,Location,Architecture Style,Peak Patient Population
New York,Willowbrook State School,https://www.asylumprojects.org/index.php?title=Staten_Island_Developmental_Center,,1938,1947,Closed,Cottage Plan,William E. Hauugaard,Halloran General Hospital | Staten Island Developmental Center,"In 1938, plans were formulated to build a facility for mentally retarded children on a 375 acres (1.5 km²) site in the Willowbrook section of the Staten Island. Construction was completed in 1942, but instead of opening for its original purpose, it was converted into a United States Army hospital and named Halloran General Hospital, after the late Colonel Paul Stacey Halloran. After the war, proposals were introduced to turn the site over to the Veterans Administration, but in October, 1947 the New York State Department of Mental Hygiene opened its facility there as originally planned, and the institution was named Willowbrook State School.
Throughout the first decade of its operation, outbreaks of hepatitis were common at the school. This led to a highly controversial medical study being conducted there between 1963 and 1966, in which healthy children were intentionally injected with the virus that causes the disease. These studies were designed to gain an understanding of the natural history of infectious hepatitis and subsequently to test the effects of gamma globulin in preventing or combating the disease.
The subjects, all children, were deliberately infected with the hepatitis virus; early subjects were fed extracts of stools from infected individuals and later subjects received injections of more purified virus preparations. Investigators defended the deliberate injection of these children by pointing out that the vast majority of them acquired the infection anyway while at Willowbrook, and perhaps it would be better for them to be infected under carefully controlled research conditions.
During the course of these studies, Willowbrook closed its doors to new patients, claiming overcrowded conditions. However, the hepatitis program, because it occupied its own space at the institution, was able to continue to admit new patients. Thus, in some cases, parents found that they were unable to admit their child to Willowbrook unless they agreed to his or her participation in the studies. This case caused a public outcry forcing the study to be discontinued because of the perception that parents and their children were given little choice about whether or not to participate in research. In 1965, Senator Robert Kennedy paid an unannounced visit to Willowbrook. He found thousands of residents “living in filth and dirt, their clothing in rags, in rooms less comfortable and cheerful than the cages in which we put animals in a zoo.” Kennedy went on to describe the institution as a “snake pit.” The visit put conditions at Willowbrook into the national spotlight and the state of New York responded by developing a five-year improvement plan. However, after making minor adjustments, conditions at the institution quickly reverted to the inhumane conditions that had thrust it into public consciousness.
Through the several decades that Willowbrook was opened, there were continuous allegations of abuse reported on by the local paper, The Staten Island Advance. For many years, these allegations were dismissed and Willowbrook continued to uphold its well-respected reputation in the community. However by early 1972, Geraldo Rivera, then a reporter for television station WABC in New York, conducted a series of investigations at Willowbrook (on the heels of a previous series of articles in the Staten Island Advance and Staten Island Register newspapers), uncovering a host of deplorable conditions, including overcrowding, inadequate sanitary facilities, and physical abuse of residents by members of the school's staff. This resulted in a class-action lawsuit being filed against the State of New York in federal court on March 17, 1972. A settlement in the case was reached on May 5, 1975, mandating reforms at the site, but several years would elapse before all of the violations were corrected. The publicity generated by the case was a major contributing factor to the passage of a federal law, called the Civil Rights of Institutionalized Persons Act of 1980.
In 1983, the State of New York announced plans to close Willowbrook, which had been renamed the Staten Island Developmental Center in 1974. By the end of March 1986, the number of residents housed there had dwindled to 250 (down from 5,000 at the height of the scandal exposed by Rivera), and the last children left the grounds on September 17, 1987. After the developmental center closed, the site became the focus of intense local debate about what should be done with the property. In 1989 a portion of the land was acquired by the City of New York, with the intent of using it to establish a new campus for the College of Staten Island. The new campus opened at Willowbrook in 1993 (at the same time, one of CSI's two other existing campuses, located in the island's Sunnyside neighborhood, was closed and that site became the home of a new high school). At 204 acres, this campus is the largest maintained by the City University of New York.
The remaining 171 acres of the state school's original property, at the south end, is still under the administration of the New York State Department of Mental Hygiene, which maintains a facility there called the Institute For Basic Research in Developmental Disabilities. At the Institution research is conducted on Down Syndrome, Autism, Alzheimer’s Disease and many rare diseases.
Main Image Gallery: Willowbrook State School",1987,"Staten Island, NYC, NY",Colonial Revival,"6,200 in 1969"
New York,Creating State School for the Blind at Batavia,https://www.asylumprojects.org/index.php?title=State_School_for_the_Blind_at_Batavia&action=edit&redlink=1,,,,,,,,"You have followed a link to a page that does not exist yet.
To create the page, start typing in the box below (see the help page for more info).
If you are here by mistake, click your browser's back button.
Warning: You are not logged in. Your IP address will be publicly visible if you make any edits. If you log in or create an account, your edits will be attributed to your username, along with other benefits.
Please note that all contributions to Asylum Projects may be edited, altered, or removed by other contributors.
If you do not want your writing to be edited mercilessly, then do not submit it here.
You are also promising us that you wrote this yourself, or copied it from a public domain or similar free resource (see Asylum Projects:Copyrights for details).
Do not submit copyrighted work without permission!
To edit this page, please answer the question that appears below (more info):
In the popular pages menu to the left, what is the word the follows Website?",,,,
New York,Creating State School for the Deaf at Rome,https://www.asylumprojects.org/index.php?title=State_School_for_the_Deaf_at_Rome&action=edit&redlink=1,,,,,,,,"You have followed a link to a page that does not exist yet.
To create the page, start typing in the box below (see the help page for more info).
If you are here by mistake, click your browser's back button.
Warning: You are not logged in. Your IP address will be publicly visible if you make any edits. If you log in or create an account, your edits will be attributed to your username, along with other benefits.
Please note that all contributions to Asylum Projects may be edited, altered, or removed by other contributors.
If you do not want your writing to be edited mercilessly, then do not submit it here.
You are also promising us that you wrote this yourself, or copied it from a public domain or similar free resource (see Asylum Projects:Copyrights for details).
Do not submit copyrighted work without permission!
To edit this page, please answer the question that appears below (more info):
In the locations menu to the left, what is the sixth country up from the bottom?",,,,
New York,Sunmount Developmental Center,https://www.asylumprojects.org/index.php?title=Sunmount_Developmental_Center,1922,,1924,Active,Cottage Plan,,Sunmount VA Hospital | Sunmount State School,"Sunmount Veterans Administration Hospital for treatment of veterans with tuberculosis opened in Tupper Lake in 1924, following the huge upsurge of TB cases among veterans of World War I. Previously, many of them had been housed by contract with the Veterans Administration in private cure cottages in Saranac Lake. Sunmount closed as a TB hospital in 1965, but reopened as a facility for people with developmental disabilities, now called Sunmount Developmental Center.  It is an immediate care facility for the mentally retarded.  It is a private – nonprofit facility that has been a Medicaid participant since 1975.",,"Tupper Lake, NY",Classical Revival,
New York,Syracuse State School,https://www.asylumprojects.org/index.php?title=Syracuse_State_School,1846,"1851 Albany, then 1854 in Syracuse",1855,Closed,"Cottage Plan as a state school, but the main building is still being used by state services.",William M. Woollett,Syracuse Developmental Center | New York State Asylum for Idiots | State Idiot Asylum | Syracuse State Institution for Feeble-Minded Children | Syracuse State School for Mental Defectives,"The New York State Asylum for Idiots was authorized by the New York State Legislature in 1851, acting upon a recommendation contained in the 1846 annual report of the New York State Asylum for Lunatics. Hervey B. Wilbur, M.D., was appointed the first superintendent and remained in that position until his death in 1883. First located on rented landed in Albany, it admitted its first ""pupils"" in 1851. The cornerstone was laid in 1854 for a new building in Syracuse, and the institution removed to Syracuse in 1855. After 1855 it was generally known as either the New York Asylum for Idiots or just the State Idiot Asylum, but in 1891 it was officially renamed the Syracuse State Institution for Feeble Minded Children, in 19-- the Syracuse State School for Mental Defectives, and finally in 19-- just the Syracuse State School. Wilbur collaborated with Edward Seguin, M.D., the originator of the physiological method of training. Maria Montessori was also Seguin's student and much of the ""Montessori Method"" is based on foundations laid by Wilbur and Seguin in Syracuse. In its 85th annual report (1935), the Syracuse State School rightly noted that it was ""the pioneer institution in the United States for the care and training of mentally deficient children."" Surgery was done in the old building, and at least one child was born there. The School also operated a farm and a number of satelite cottages. In the 1970s, the Syracuse State School building was torn down and replaced by a residential facility called the Syracuse Developmental Center. With the growing emphasis on community living rather insitutionalization for developmentally disabled persons, no new individuals were placed at SDC and there has been a gradual movement of residents into the community. In early 1998, there were about six persons left. SDC is to be closed, and it is not clear what will happen to the building. [1]
The colonies were limited in capacity to around 20 boys or girls and the school made every effort to make these colonies more home like with furnishings and surroundings.  To achieve this, the colonies were located within residential neighborhoods surrounding Syracuse.  Four girl colonies were located within the city limits while a boys colony was on a farm on the outskirts of Syracuse.  The colonies within the city did not differ from the homes surrounding them.  The girls were employed as domestics within residential homes and the boys were used as labor in local farms and other industries. The wages the boys and girls made went into paying a minimum  charges for room and board with the remaining wage placed in a personal account for the student.  These accounts were used to pay for personal clothing and other expenses the student occurs.  There was no time limit as far as how long a student would be at a colony.  It depended on how fast they matured and when the time was right, they could move out of the colony to live on their own.
Main Image Gallery: Syracuse State School","June 17, 1998","Syracuse, NY",Institutional Gothic/Italian Villa,
New York,Wassaic State School,https://www.asylumprojects.org/index.php?title=Wassaic_State_School,1926,1927,1931,Closed,Cottage Plan,,Wassaic State School for Mental Defectives |  Wassaic Developmental Center,"The Wassaic State School opened on Jan. 7, 1931 as one of five new statewide facilities established to house and work with individuals who suffered with developmental disabilities. The School operated on a complex in the Town of Amenia hamlet. Prior to the New York Department of Mental Hygiene’s acquisition of the property in 1926, it consisted of three separate farms. The operation was established to alleviate overcrowding at other facilities in New York City and Long Island. Within three years of acquiring the land 27 buildings were already nearing completion.
Among its first buildings were Barton, Carter and Amity halls, all standing two-stories tall and featuring an 11-bay Mission-style design. Ten of the buildings were earmarked for occupancy by 2,400 residents while another four were intended for employee housing; others served auxiliary departments and operations. Most of the buildings constructed in the initial phase were built along two large ovals that were separated by two dining halls and a hospital. In 1933, an administration building was added. Also standing two-stories, that structure boasted a Georgian Revival design and featured a façade that spanned nine bays. A three-story, 13-bay building, named Berkshire Hall, was erected simultaneously to the administration building, and its primary purpose was to provide classroom activities in sewing and arts and crafts for female residents. The large building was also fitted with a bowling alley and auditorium.
The overall layout of the campus was carefully designed according to a specific resident’s treatment, as well as the severity level and demeanor of the individuals involved. Male and female sections were located at opposite ends of the campus and separate infirmaries served each group. It didn’t take long for the state-run facility to reach its capacity. As was experienced at other facilities of its kind, resident escapes occurred occasionally and state and local law enforcement got involved when the runaways engaged in unlawful action.
In the mid-1940s, additional security measures, including the installation of window guards and a new wall, were introduced in an attempt to deal with patients who were considered a high risk for flight. Still, overcrowding plagued many of the state-operated sites and by the 1950s, Wassaic State School reached its peak, housing up to 5,000 patients. In 1965, the Willowbrook State School on Staten Island stimulated scandalous newspaper headlines when an investigation found that it exceeded its capacity by about 2,000 residents, and those living there did so in filth and clad in dirty clothing. The scandal, which was broadcast nationwide, caused state officials to closely examine all the facilities.
The Wassaic operation subsequently went through two name changes through the years, first to the Wassaic Developmental Center and later to the Taconic Developmental Disabilities Service Office (DDSO). The facility closed in late 2013 in order to integrate individuals with developmental disabilities into the community. While residents are now gone from the facility, a support staff still works at the developmental disabilities service office building, located in the center of the complex.
About 600 graves of former patients sits on a hilltop on the campus marked only by numbers on flat iron plaques.",2014,"Amenia, NY",,"4,500 in 1960s"
New York,Willowbrook State School,https://www.asylumprojects.org/index.php?title=Willowbrook_State_School,,1938,1947,Closed,Cottage Plan,William E. Hauugaard,Halloran General Hospital | Staten Island Developmental Center,"In 1938, plans were formulated to build a facility for mentally retarded children on a 375 acres (1.5 km²) site in the Willowbrook section of the Staten Island. Construction was completed in 1942, but instead of opening for its original purpose, it was converted into a United States Army hospital and named Halloran General Hospital, after the late Colonel Paul Stacey Halloran. After the war, proposals were introduced to turn the site over to the Veterans Administration, but in October, 1947 the New York State Department of Mental Hygiene opened its facility there as originally planned, and the institution was named Willowbrook State School.
Throughout the first decade of its operation, outbreaks of hepatitis were common at the school. This led to a highly controversial medical study being conducted there between 1963 and 1966, in which healthy children were intentionally injected with the virus that causes the disease. These studies were designed to gain an understanding of the natural history of infectious hepatitis and subsequently to test the effects of gamma globulin in preventing or combating the disease.
The subjects, all children, were deliberately infected with the hepatitis virus; early subjects were fed extracts of stools from infected individuals and later subjects received injections of more purified virus preparations. Investigators defended the deliberate injection of these children by pointing out that the vast majority of them acquired the infection anyway while at Willowbrook, and perhaps it would be better for them to be infected under carefully controlled research conditions.
During the course of these studies, Willowbrook closed its doors to new patients, claiming overcrowded conditions. However, the hepatitis program, because it occupied its own space at the institution, was able to continue to admit new patients. Thus, in some cases, parents found that they were unable to admit their child to Willowbrook unless they agreed to his or her participation in the studies. This case caused a public outcry forcing the study to be discontinued because of the perception that parents and their children were given little choice about whether or not to participate in research. In 1965, Senator Robert Kennedy paid an unannounced visit to Willowbrook. He found thousands of residents “living in filth and dirt, their clothing in rags, in rooms less comfortable and cheerful than the cages in which we put animals in a zoo.” Kennedy went on to describe the institution as a “snake pit.” The visit put conditions at Willowbrook into the national spotlight and the state of New York responded by developing a five-year improvement plan. However, after making minor adjustments, conditions at the institution quickly reverted to the inhumane conditions that had thrust it into public consciousness.
Through the several decades that Willowbrook was opened, there were continuous allegations of abuse reported on by the local paper, The Staten Island Advance. For many years, these allegations were dismissed and Willowbrook continued to uphold its well-respected reputation in the community. However by early 1972, Geraldo Rivera, then a reporter for television station WABC in New York, conducted a series of investigations at Willowbrook (on the heels of a previous series of articles in the Staten Island Advance and Staten Island Register newspapers), uncovering a host of deplorable conditions, including overcrowding, inadequate sanitary facilities, and physical abuse of residents by members of the school's staff. This resulted in a class-action lawsuit being filed against the State of New York in federal court on March 17, 1972. A settlement in the case was reached on May 5, 1975, mandating reforms at the site, but several years would elapse before all of the violations were corrected. The publicity generated by the case was a major contributing factor to the passage of a federal law, called the Civil Rights of Institutionalized Persons Act of 1980.
In 1983, the State of New York announced plans to close Willowbrook, which had been renamed the Staten Island Developmental Center in 1974. By the end of March 1986, the number of residents housed there had dwindled to 250 (down from 5,000 at the height of the scandal exposed by Rivera), and the last children left the grounds on September 17, 1987. After the developmental center closed, the site became the focus of intense local debate about what should be done with the property. In 1989 a portion of the land was acquired by the City of New York, with the intent of using it to establish a new campus for the College of Staten Island. The new campus opened at Willowbrook in 1993 (at the same time, one of CSI's two other existing campuses, located in the island's Sunnyside neighborhood, was closed and that site became the home of a new high school). At 204 acres, this campus is the largest maintained by the City University of New York.
The remaining 171 acres of the state school's original property, at the south end, is still under the administration of the New York State Department of Mental Hygiene, which maintains a facility there called the Institute For Basic Research in Developmental Disabilities. At the Institution research is conducted on Down Syndrome, Autism, Alzheimer’s Disease and many rare diseases.
Main Image Gallery: Willowbrook State School",1987,"Staten Island, NYC, NY",Colonial Revival,"6,200 in 1969"
New York,Creating Addison Sanitarium,https://www.asylumprojects.org/index.php?title=Addison_Sanitarium&action=edit&redlink=1,,,,,,,,"You have followed a link to a page that does not exist yet.
To create the page, start typing in the box below (see the help page for more info).
If you are here by mistake, click your browser's back button.
Warning: You are not logged in. Your IP address will be publicly visible if you make any edits. If you log in or create an account, your edits will be attributed to your username, along with other benefits.
Please note that all contributions to Asylum Projects may be edited, altered, or removed by other contributors.
If you do not want your writing to be edited mercilessly, then do not submit it here.
You are also promising us that you wrote this yourself, or copied it from a public domain or similar free resource (see Asylum Projects:Copyrights for details).
Do not submit copyrighted work without permission!
To edit this page, please answer the question that appears below (more info):
What is the second word in our logo?",,,,
New York,Albany Hospital for Incurables,https://www.asylumprojects.org/index.php?title=Albany_Hospital_for_Incurables,,1845,1902,Preserved,Single Building,,William Walsh House | Reilly House (Current),"When the house was built, in 1845, it was south of Albany's city limits, in the Town of Bethlehem. William Walsh and his wife were part of the city's wealthy aristocracy. The house was purchased in 1902 by Eleanor Spensley, who had founded the Hospital for Incurables in downtown Albany 20 years earlier. She died two months later. For hospital purposes the roof was raised and dormer windows added.
In that form, the Hospital for Incurables continued operating in the house until 1973. After it was closed the two rear wings were demolished. It remained vacant, owned by the hospital, until sometime after it was listed on the Register in 1974 when the Addictions Care Center of Albany acquired the property. The roof was completely replaced with a flat roof and modern sliding windows were installed. It is now the Reilly House, a sober living environment that can hold up to 12 men at a time.
Addendum: The main house was demolished by the Albany Citizens Council on Alcoholism as it was non-salvagable. The ACCA maintained the back unit  home, which was originally nurses residences for those employed at the hospital. This was concerted into a man's halfway residence for addiction and recovery. Another building, originally used for storage of maintenance eguipment, housed self help meetings. In the late 90's both buildings were demolished and a new facilty, housing the residential facility, outpatient services and administrative offices, was built. It openened sometime in the early 200's and still operates today.  NMcGahay",1973,,,
