State,Hospital Name,URL,Established,Construction Began,Opened,Current Status,Building Style,Architect(s),Alternate Names,Raw Text,Closed,Location,Architecture Style,Peak Patient Population
New York,Middletown State Hospital,https://www.asylumprojects.org/index.php?title=Middletown_State_Hospital,1870,1870,1874,Closed,Cottage Plan,Carl Pfeiffer,Middletown Homeopathic Hospital | Middletown Psychiatric Center,"This institution was originally founded in pursuance of an act of the legislature passed April 28, 1870, establishing at Middletown, in Orange county, a state lunatic asylum for ""the care and treatment of the insane and the inebriate upon the principles of medicine known as homœopathic."" The movement, however, which led to the ultimate establishment of the hospital had its inception in the address of John Stanton Gould before the State Homœopathic Medical Society at its session in Albany in February, 1866. The subject of the orator's discourse was ""The Relation of Insanity to Bodily Disease,"" and in the course of his remarks attention was called to the necessity of a new state asylum for lunatic's in the southern tier counties of the state, and claimed as a matter of justice that when organized the institution should be placed under the homœopathic school of medicine.
This seems to have been the crystallizing point of the earnest desire of the homœopathic profession throughout the state, for at the next meeting of the state society in February, 1867, a resolution was offered by Dr. Paine of Albany to the effect that ""Whereas, a bill authorizing the erection of a new lunatic asylum is now pending before the legislature,"" therefore a committee should be appointed to prepare a memorial asking ""for such action as shall place said institution under the care of the homœopathic school.""
But notwithstanding the laudable efforts of the advocates of the enterprise and their apparent zeal for its consummation, nothing was accomplished until some years afterward. In the meantime, however, Dr. Hilon Doty had come forward with a proposition to turn over his private asylum, ""Margarettsville Retreat for the Insane,"" to a board of trustees or managers of an incorporated institution under homœopathic control, and while an act of incorporation was secured in 1869 through the influence of the state medical society, nothing was done until December of that year, when Dr. George E. Foote of Middletown presented to the homœopathic profession a plan to establish an insane asylum, founded by subscription and endowment, and organized as a close corporation. This proposition met with favor, and sufficient subscriptions were received to insure success, but it soon became necessary to give the institution a more public character and to enlist state support. Accordingly, it was planned to make it a state asylum ; the time was deemed ripe for such a movement, and the governor in his last message had pointed out the need of better and more accommodations for the insane charges upon the public bounty.
The friends of the movement were quick to see their opportunity and threw themselves earnestly into the work, leaving no stone unturned until their desires were gratified in the passage of an act, April 28, 1870, establishing a state lunatic asylum at Middletown under homœopathic management. It was not the first homœopathic asylum in the world, as has been asserted, but was the first of its kind in America under purely homœopathic management. It was formally opened for patients, April 20, 1874. The name was changed in conformity to the provisions of an act of the legislature, and then became known as Middletown State Homœopathic Hospital.
Middletown Psychiatric Center (MPC) offers contemporary treatment for adults with complex mental illnesses. The goal of treatment is recovery. Treatment and rehabilitation by an inter-disciplinary team of mental health professionals aim at equipping patients to manage their illness, strengthen their skills and better the quality of their lives. MPC¹s inpatient units and administration are located in Tuckerman Hall with Outpatient and Residential Services throughout Orange and Sullivan counties.
MPC's innovative 25,000 square foot Treatment Mall brings together, in one location, contemporary treatment and rehabilitation, specialized programs to build daily life skills, indoor and outdoor activities, hobbies and patient services. This program has been replicated in over 25 hospitals in 7 states.
MPC offers programs to meet patients' individual treatment requirements while responding with sensitivity to their diverse cultural backgrounds and needs. Specialized services include programs for: co-occurring disorders of mental illness and substance abuse; geriatric patients participating in the community through volunteer work (e.g., Meals on Wheels); patients requiring a structured, secure treatment setting; patients in need of comprehensive skills building; cognitive remediation to improve intellectual functioning.
MPC participates with Columbia University and Psychiatric Institute in advanced psychiatric training in Geriatric and Public Psychiatry. MPC serves as a nexus for consultations and dissemination of knowledge to the community, from information about new medications to assistance in the design of humane residential environments. Fully accredited by the Joint Commission on Health Care Organizations, Middletown Psychiatric Center has an outstanding record in surveys conducted by the Joint Commission on Accreditation of Healthcare Organizations (JCAHO) and the Federal Health Care Finance Administration.
MPC has pioneered the development of a Community Campus, a dramatic departure from the isolation of traditional psychiatric hospitals. The hospital now shares the 226 acre grounds with a full spectrum of mutually supportive public and non-profit agencies serving the community in the areas of mental health, health, education, human services, housing and economic development. For patients, the Community Campus means convenient access to community services and skills building programs. By breaking down barriers which historically separated hospital from community, the stigma of mental illness is reduced.[1]
In the mid to late 1900’s, attendance at Middletown dwindled, as it did in all American asylums at the time, due to deinstitutionalization and refinancing of state medical care. Middletown changed is focus to outpatient programs, but ultimately closed in 2006. Various social services and rehab facilities continued to operate on the campus, which was mostly abandoned.
Main Image Gallery: Middletown State Hospital",2006,"Middletown, NY",Second Empire & Colonial Revival,
New York,Mid-Hudson Forensic Psychiatric Center,https://www.asylumprojects.org/index.php?title=Mid-Hudson_Forensic_Psychiatric_Center,,,1916,Active,Cottage Plan,Charles B. Meyers,New York City Reformatory | New Hampton Farms Reformatory,"In 1916, a property in New Hampton became a city-run reformatory for boys. The reformatory was later taken over by the state and still later, in the 1970's, it was converted to a forensic psychiatric hospital to replace the old Matteawan asylum in Fishkill. Another property in nearby Chester was operated as a farm colony for women offenders. Today, it is a shelter for homeless New York City men.
Today Mid-Hudson Forensic Psychiatric Center (MHFPC) is a secure adult psychiatric center that provides a comprehensive program of evaluation, treatment, and rehabilitation for patients admitted by court order. These admissions are consequent to judicial findings of ""incompetent to stand trial"" or ""not responsible by reason of mental disease or defect."" [1]It is home to more than 250 men and women deemed both mentally ill and too violent for society. It is the largest forensic facility in New York state.
Mid-Hudson Forensic Psychiatric Center will close by 2017 under a consolidation plan by the state Office of Mental Health. The closure is included in a plan to overhaul the state’s psychiatric services over the next four years by consolidating 24 inpatient hospitals statewide into 15 regional centers and establishing more than two dozen outpatient service hubs.
The names of current and former patients at the Mid-Hudson Forensic Psychiatric Center are confidential for medical reasons. But a review of old news accounts reveals a few of the more notorious patients to call Mid-Hudson home through the years:",,"New Hampton, NY",Neo-Classical,
New York,Mohansic State Hospital,https://www.asylumprojects.org/index.php?title=Mohansic_State_Hospital,1909,1911,,,N/A,,"Mohansic State Insane Asylum, | Mohansic State Hospital for the Insane","Mohansic State Hospital was a hospital which existed near Yorktown Heights in Westchester County, New York. On October 17, 1909, the State Commission in Lunacy purchased 550 acres on Lake Mohansic for $135,000, with the intention of building an asylum to accommodate 2,000 (later 6,000) patients to relieve the overcrowding of institutions in New York City. The property was later expanded to 660 acres, with an additional 490 acres for the New York State Training School for Boys. Dr. Isham G. Harris became superintendent of Mohansic State Hospital in 1910. On June 16, 1910, 12 patients were transferred to the institution from the Central Islip State Hospital.
In 1911, a spur from the New York and Putnam Railroad was built from Yorktown Heights and across Crom Pond to the site. Construction of the hospital was underway, starting with three ""cottages"" which housed 165 inmates. Strang Cottage was the site of the murder of 19 year-old hospital attendant Charles Wiley, Jr. on July 4, 1913.
In 1916 continued construction on the asylum became the subject of heated debate. Senator Robert F. Wagner cited concerns of pollution to the New Croton Reservoir and the New York City water supply from sewage the asylum would produce, and Senator Henry M. Sage cited the considerable amount the State had already spent developing the property at New York City's request. New York State Governor Charles S. Whitman eventually ordered construction stopped to protect the watershed, and in 1918 he signed a bill which abandoned the hospital project. The funds for Mohansic were re-appropriated for use in construction of an asylum in upstate New York, and the property was converted to a state park in 1918. The site is currently occupied by Franklin D. Roosevelt State Park.",1918,"Yorktown Heights, NY",,
New York,Creating Newville State Hospital,https://www.asylumprojects.org/index.php?title=Newville_State_Hospital&action=edit&redlink=1,,,,,,,,"You have followed a link to a page that does not exist yet.
To create the page, start typing in the box below (see the help page for more info).
If you are here by mistake, click your browser's back button.
Warning: You are not logged in. Your IP address will be publicly visible if you make any edits. If you log in or create an account, your edits will be attributed to your username, along with other benefits.
Please note that all contributions to Asylum Projects may be edited, altered, or removed by other contributors.
If you do not want your writing to be edited mercilessly, then do not submit it here.
You are also promising us that you wrote this yourself, or copied it from a public domain or similar free resource (see Asylum Projects:Copyrights for details).
Do not submit copyrighted work without permission!
To edit this page, please answer the question that appears below (more info):
What is the second word in our logo?",,,,
New York,Pilgrim State Hospital,https://www.asylumprojects.org/index.php?title=Pilgrim_State_Hospital,1928,1929,1930,Active,Cottage Plan,Starrett & Van Vleck,Pilgrim Psychiatric Center,"At the time it was opened, it was the largest hospital of any type in the world. Its size has never been exceeded by any other facility, although today Pilgrim is far smaller than it used to be.
By 1900, overcrowding in city asylums was becoming a major problem that many tried to resolve. One answer was to put the mentally ill to work farming in a relaxing setting on what was then rural Long Island. The new state hospitals were dubbed ""Farm Colonies"" because of their live-and-work treatment programs, agricultural focus and patient facilities. However, these farm colonies, the Kings Park State Hospital (later known as the Kings Park Psychiatric Center) and the Central Islip State Hospital (later known as the Central Islip Psychiatric Center), quickly became overcrowded, just like the earlier institutions they were supposed to replace.
NY state responded by making plans for a third so-called farm colony, what was to become the Pilgrim State Hospital, named in honor of the former New York State Commissioner of Mental Health, Dr. Charles W. Pilgrim. The state bought up approx. 1,000 acres (4.0 km²) of land in Brentwood and began construction in 1930. The hospital opened on October 1, 1931 as a close knit community with its own police and fire department, courts, post office, a LIRR station, power plant, potter's field, swinery, cemetery, water tower and houses for doctors, psychiatrists, and asylum administrators. A series of underground tunnels were used for routing steam pipes and other vital utilities.
The hospital would continue to grow as the patient population increased. Eventually, the state of New York bought up more land to the southwest of the facility to construct Edgewood State Hospital, a short-lived stand-alone facility that operated under Pilgrim's umbrella. In fact, Pilgrim State was so large that it reached into four Suffolk townships- Huntington, Babylon, Smithtown and Islip- and had two major state roads passing through its bounds.
During World War II, the War Department took over control of the entire Edgewood facility along with three new buildings at Pilgrim, buildings 81, 82, and 83 (visible from the Long Island Expressway and still used today). The War Department constructed numerous temporary structures and operated Edgewood and buildings 81-83 as ""Mason General Hospital,"" a psychiatric hospital devoted to treating battle-traumatized soldiers. Famed filmmaker John Huston, who received a special commission in the U.S. Army Signal Corps during World War II, made a documentary at Mason called ""Let There Be Light"" that showed the effects of war on mental health. The film sparked a firestorm of controversy and was not seen by the public until 1981.
After the war, Pilgrim experienced a surge in patient numbers that made it the world's largest hospital, topping out at 13,875 patients and over 4,000 employees in 1954. Around this time, the old ""rest and relaxation"" philosophy gave way to more extreme measures like pre-frontal lobotomies and electro-shock therapy. However, Pilgrim and the other state hospitals began to decline shortly afterwards with the arrival of pharmaceutical alternatives to institutionalization.
As medicine and community care became a viable alternative to institutionalization, large mental institutions began to decline. Edgewood, the last completed Long Island asylum, closed its doors in December 1971 following decentralization. Kings Park and Central Islip continued operation, while at the same time downsizing. Pilgrim was not exempt from this downsizing either, and parts of the campus began to close throughout the 1970s and into the 1980s. Buildings 81-83 were briefly used as a correctional facility in the 1980s as a result of Pilgrim's mass downsizing, but after much community protest they reverted back to psychiatric use. In the early 1990s, with declining patient populations in the three remaining hospitals, the New York State Office of Mental Health (formerly the Department of Mental Hygiene) began making plans to re-organize the Long Island hospitals. The plans were implemented in the fall of 1996, when Kings Park and Central Islip were formally shuttered, and the remaining patients from both those facilities were transferred to Pilgrim. The Central Islip site partly became a campus for the New York Institute of Technology, but was also used for residential and commercial development or left abandoned. At Kings Park, three buildings housing community residences administered by Pilgrim remain open. Much of the former campus has become a state park, while the rest sits in abandonment.
Pilgrim is today the last of the state asylums still operating on Long Island. However, it is no longer what it used to be. The farming section of the hospital was sold off, renovated, and became the Western Campus of the Suffolk County Community College in 1974. A large part of the Pilgrim campus was sold to a developer, and numerous abandoned structures on those lands were demolished in recent years. However, rebuilding has not begun. Other abandoned structures, like the former administration building, medical/surgical building, doctor's residences were demolished in 2012. The power plant and utilities section remain standing for the time being (those parts of the campus are owned by the developer as well). Only about a third of the original Pilgrim campus is still in operation, though its future is also cloudy.
Pilgrim also hosts a museum on site, which displays items from Kings Park, Central Islip, Pilgrim, and Edgewood such as pictures, old newsletters, relics from abandoned and/or demolished buildings, and other historical information that hint back to a largely forgotten era.
Long Island Psychiatric Museum
Pilgrim Psychiatric Center
998 Crooked Hill Road
Brentwood, NY 11717
(631)761-2118 or (631)761-3805
Monday - Friday 8AM - 4PM by Appointment Only.
Main Image Gallery: Pilgrim State Hospital
The following eleven minute video was filmed for 20/20's report on Lobotomy.  It mostly focuses on Pilgrim State Hospital and a few patients who had undergone a lobotomy at the institution.",,"Brentwood, Long Island, NY",,"13,875 in 1954"
New York,Ray Brook State Hospital,https://www.asylumprojects.org/index.php?title=Ray_Brook_State_Hospital,,,1904,Active,Cottage Plan,,"New York State Hospital for Incipient Pulmonary Tuberculosis | State Hospital for Tubercular Patients, Ray Brook, New York  | Adirondack Correctional Facility","The New York State Hospital for Incipient Pulmonary Tuberculosis (as it was originally named), was commonly known simply as ""Ray Brook."" Opened in 1904, Ray Brook was the first New York State-operated tuberculosis sanatorium, and the second in the United States, after Massachusetts. After a protracted study of alternative sites, New York State chose to establish its hospital in the highly-regarded fresh air of the Adirondack Mountains, near the critical mass of tuberculosis experts in Saranac Lake.
Although medical developments made sanatoria obsolete starting in the mid-1950s, the State Hospital at Ray Brook continued to operate until the mid-1960s. The property was then transferred from the Department of Health to the new Drug Addiction Control Commission, combining enforcement and treatment; in 1971 the new facility opened as the Ray Brook Rehabilitation Center, housing 70 to 130 women addicts. However, it was judged a failure, and closed within five years. It was succeeded by a camp program for adult inmates, ""Camp Adirondack"". Working with the Department of Environmental Conservation, ""campmen"", as inmates were known, were employed in logging, sawmill, wildlife preservation, construction of campsites and snowmobile and cross-country ski trails, and construction of a toboggan run at the Mount Pisgah ski area. The camp also constructed the Ice Palace each winter for the Saranac Lake Winter Carnival.
With the selection of Lake Placid for the 1980 Winter Olympics the inmates worked on the Olympic trails at Mount Van Hoevenburg. The camp facilities were used for Olympic staff housing, which led to renovation of the water treatment plant, sewage system, housing and food service areas. During the games, the inmates were relocated to other prison facilities in the state, and were replaced by 900 State Police and 300 U.S. Customs Bureau personnel, National Guard and security forces of foreign governments who provided security for the Games. Two hundred acres of the Camp Adirondack was used as the site for the Olympic Village; after the games it became a new federal prison, the Federal Correctional Institution, Ray Brook.
The newly improved facilities allowed a substantial increase in the prison population, which led to the erection of the first security fence around the perimeter of the complex. In 1981, Camp Adirondack was designated a medium-security facility and renamed the Adirondack Correctional Facility. It presently is rated as a 700-man, medium-security prison, and employs 311.[1]
Main Image Gallery: Ray Brook State Hospital",,"Ray Brook, NY",,
New York,Rochester Psychiatric Center,https://www.asylumprojects.org/index.php?title=Rochester_Psychiatric_Center,1826,1868,1857,Active,Cottage Plan,Franklin Ware & William Haugaard,Monroe County Insane Asylum | Rochester State Hospital,"In 1826 Monroe County established an Almshouse in order to care for it's growing population of poor. By 1857 they found the need to open a separate wing of the building simply to house and treat the poor who were mentally disabled. The number of patients in the separate wing had increased so dramatically by 1862 that it was necessary to expand into a separate building the housed only the mentally disabled and insane. This separate building was named the Monroe County Insane Asylum.
New York State Legislature passed a bill providing funding for the establishment of state hospitals to care for the insane in 1890, and by July 1, 1891 Monroe County Insane Asylum became Rochester State Hospital. It's current name, Rochester Psychiatric Center, was changed in the early 1970's though it remains a state funded hospital. The Monroe County Sheriff’s Office currently operates a forensic unit at the center.
In 2015, Morgan Management and the ARNGroup LLC, both developers, have submitted proposals to redevelop the old psychiatric center located on Elmwood Avenue on the southeast side of Rochester. The 16 story Terrance tower will be demolished and replaced by the project’s gateway building which will be 5 to 12 stories, with rooftop terraces and balconies for many of its 320 apartment homes.
Main Image Gallery: Rochester Psychiatric Center",,"Rochester, NY",Georgian Revival,
