State,Hospital Name,URL,Established,Construction Began,Opened,Current Status,Building Style,Architect(s),Alternate Names,Raw Text,Closed,Location,Architecture Style,Peak Patient Population,year_opened_LLM,year_closed_LLM,number_of_beds_LLM,number_of_patients_LLM,peak_patient_population_LLM,hand_check_flag_LLM
Oklahoma,Park Hill Mission School,https://www.asylumprojects.org/index.php?title=Park_Hill_Mission_School,,,,Active,Cottage Plan,,Park Hill Presbyterian School |  Enid State School |  Northern Oklahoma Hospital |  Northern Oklahoma Resource Center,"Samuel Newton and his wife, Mary, were among the earliest missionaries to the Cherokee Indian Territory. They worked at a mission station named Forks of the Illinois, which was established in 1830 on the east side of the Illinois River close to the mouth of the Barren Fork. The spot was so unhealthy that Mary and their small daughter died. In 1837 the mission was moved three miles west to Campbell Springs. Newton named the area Park Hill because it reminded him of the estates of noblemen in England.
Park Hill soon became the site of a thriving mission. Reverend Samuel Austin Worcester, who had been a missionary and printer among the Cherokee in the East, came west to continue his work. He set up the printing press at Union Mission, but its buildings were dilapidated and the location inconvenient to the Cherokee. Worcester chose Park Hill as the permanent site for his mission and construction began in the summer of 1836. He and his family moved there soon afterwards. In June of 1837 he set up the printing press a mile further to the west of Newton’s school in a meadow overlooking the Park Hill valley. That same summer he established a church with nineteen members. Major George Lowrey soon became deacon and retained that post until his death in 1852. By 1838 the mission school had been moved up to the meadow with Samuel Newton as the teacher. Other teachers there in the 1830s were Esther Smith from Harrisburg, New York, and Sarah Ann Palmer.
At the mission printing office Worcester continued the work he had begun in the East, printing literature to educate and Christianize the Cherokee. Elias Boudinot, former editor of the Cherokee Advocate, helped with translating and printing until his death in 1839. Stephen Foreman replaced him as translator. With their help Worcester translated and printed most of the Bible in Cherokee. John F. Wheeler was the first printer, later replaced by John Candy. The press turned out textbooks, the Cherokee Almanac, religious tracts, and volumes of Cherokee hymnals.
A brick church building was completed at the mission by 1854. Cherokee Chief John Ross and merchant and planter, George M. Murrell, donated much of the money to buy the church bell.
The Park Hill Mission and Press came to an end with the Civil War. Reverend Charles Torrey came to help run the mission when Worcester became an invalid after a serious accident. Torrey became supervisor after Worcester’s death in 1859. Shortly before the war began, the American Board of Commissioners for Foreign Missions decided to close the mission because of the troubles the impending war was bringing to the region. They also believed the Cherokees were no longer considered a heathen people and thusly did not require the help of missionaries. (Ironic since there continued to be religious mission schools here for the next 100 years.)
Park Hill later became home of the Cherokee Female Seminary. Chief John Ross held ceremonies in 1847 to lay the cornerstones for the male and female seminaries, which would be located in Tahlequah and Park Hill, respectively. Both were opened in 1851. These public educational institutions were considered equivalent of high schools. Teachers were recruited from such places as Mount Holyoke School in Massachusetts and brought to the Cherokee Nation to teach Cherokee children. Daily regimens at the school included studies of Latin, math, science, rhetoric, composition, geography, philosophy, and religion. Church attendance was mandatory.
In 1887 the Female Seminary burned, creating a huge loss for the tribe. After burning the school was moved to Tahlequah which had a better water source. In 1889, a new building was dedicated on the north side of town. The seminary continued as an entity until 1909, when the state purchased the building. Subsequently, it was chosen as the site for the new Northeastern State Normal School, which has now evolved into Northeastern State University. Today, the building, known as Seminary Hall, is an icon of the NSU campus. The first Female Seminary is located at the present site of the Cherokee Heritage Center, where three brick columns salvaged from the building stand to commemorate this prestigious institution.",,"Enid, OK",,"1,444 in 1963",,,,,,1
Oklahoma,Pawnee Boarding School,https://www.asylumprojects.org/index.php?title=Pawnee_Boarding_School,1876,,1876,Active,,,Pawnee Agency | Pawnee Boarding School | Pawnee Indian School,"The policy of the U.S. Government toward the Native Americans was to get them to accept allotment (ownership of tribal land by individual tribesmen) and American style education. Together, these two things were expected to end the tribes' dependence on the American government. Toward that end, the government had built schools on Pawnee land in Nebraska Territory, where most of the tribe lived by the time of the American Civil War. Treaties between the U.S. and the Pawnees had established that the latter would cede their lands in Nebraska to the government and move to an area the government had designated for them in Indian Territory. The removal had been scheduled for 1876. The industrial school in Nebraska Territory operated by the government for the Pawnees closed in September 1875, since holding classes would be impractical during the move.
For various bureaucratic reasons, the planned boarding schools could not be ready as soon as the tribe arrived at their destination. However, it was possible to open two day schools in February 1876. These could provide only an elementary level of education. Government policy makers held that a hierarchical system would produce satisfactory results. Day schools would introduce children to the English language and basic primary education. Those children who made satisfactory progress would move on to boarding schools, Boarding schools would continue the primary subjects, add more advanced topics and focus half of each day on ""industrial education."" Off-reservation schools offered more advanced education and industrial training.
Although planning for the boarding school was well advanced in February 1876, construction funding had not been approved. An 1857 treaty had appropriated ten thousand dollars a year to operate two industrial education (manual labor) schools. The Pawnees had expected to use the unexpended portion of the money to construct the new school. The government's Indian Office held that the funds were only to support existing schools, not to build new ones. By the summer of 1877, the Indian Office finally agreed that not using the funds to build the new school meant that the Pawnees would have no school, therefore abrogating the treaty. The construction contract was awarded shortly after. The new school building and girls' dormitory were completed in May, 1878. However, other delays ensued. A cistern dug near the school leaked all its water. Later, it was determined that the cement used in its construction was still ""green"" (uncured) when water first filled the cistern. This was repaired, but purchasing school supplies was delayed in the Fall by bureaucratic delays getting the required approvals. School finally opened on November 11, 1878.
McClure documents complaints and problems that cropped up after the school opened. One was overcrowding. Agents regularly requested funding for a second school, as promised in the 1857 treaty. No such action was ever taken. In 1884, the Agent reported that the water supply had always been inadequate; water of poor quality had to be hauled from a source a half mile away. Official visitors found 39 girls sharing 13 beds in 1889. The sewage system was inadequate as late as 1900. Despite the lack of a satisfactory sewer system, there was a new building program during the 1890s that resulted in the construction of a commissary and carpenters' shop (1891) and the Boys' Dormitory (1892).
The original Boys' Dormitory was destroyed by a fire in 1904. There were no deaths or injuries, but the monetary loss was estimated at 25 to 30 thousand dollars. The school sent some of the youngest boys back home and housed the remainder in other buildings. The administration also concerned itself about fire safety measures in other buildings. The burned building was replaced in 1909.
In 1932 another large building was constructed to consolidate a number of functions that had previously been scattered in other buildings. It was said to have been completed in September 1933, and contained classrooms, offices, an auditorium and a gymnasium. This was the last building constructed on the school campus, and has several features not found on other buildings, including:
-a T-shaped floor plan, with classrooms and offices in the cross wing and a gymnasium in the column;
-a portico in the center of the cross wing, with three round-arched doorways and, inside the portico, a double-doored entrance framed by a large round-headed arch;
-a date stone above the center of the portico bears the number ""1932"" and the name ""A. R. Snyder"", who was the school superintendent at that time;
decorative arched porticos toward the sides of the front facade, with slightly recessed brick beneath them.
The main part of the building has a flat-top and hipped mansard roof which extends over each end of the front (west) facade, forming a gable over the decorative arch in each end of the facade. Each gable contains a fanlight. There is a flat roof over the portico. The gymnasium has a low-pitch gable roof with no overhang. The roofing material is a light colored metal, and there is a parapet above the ridge. Elsewhere, the roof is covered with modern composition shingles.
This was the main school building until the boarding school ceased to operate in 1958. The Bureau of Indian Affairs (BIA) then turned the building over to the city of Pawnee, which made it available for the Good Samaritans, a charitable service organization to turn it into a nursing home. The Samaritans vacated the building in 1972, when the city announced it would return the school property to the Pawnee tribe. The 1932 School Building was renovated in 1976, then leased by the BIA to become the administrative offices for the Pawnee Agency.
In 2011, the Oklahoma Historical Society's Historic Preservation Office awarded its Citation of Merit for the rehabilitation of three buildings of the former boarding school. The buildings were: the former staff quarters, the dining hall and Pawnee Indian Clinic. All three now serve the new Pawnee Nation College. Recipients of the award were the Pawnee Business Council, Barrett L. Williamson Architects, and Builders Unlimited.",1958,"Pawnee, Pawnee Tribal Reserve, OK",,,1878,1958,13,,39,0
Oklahoma,Pecan Creek Boarding School,https://www.asylumprojects.org/index.php?title=Pecan_Creek_Boarding_School,,,,Demolished,,,Pecan Creek Boarding School,,,,,,,,,,,1
Oklahoma,Creating Ponca Boarding School,https://www.asylumprojects.org/index.php?title=Ponca_Boarding_School&action=edit&redlink=1,,,,,,,,"You have followed a link to a page that does not exist yet.
To create the page, start typing in the box below (see the help page for more info).
If you are here by mistake, click your browser's back button.
Warning: You are not logged in. Your IP address will be publicly visible if you make any edits. If you log in or create an account, your edits will be attributed to your username, along with other benefits.
Please note that all contributions to Asylum Projects may be edited, altered, or removed by other contributors.
If you do not want your writing to be edited mercilessly, then do not submit it here.
You are also promising us that you wrote this yourself, or copied it from a public domain or similar free resource (see Asylum Projects:Copyrights for details).
Do not submit copyrighted work without permission!
To edit this page, please answer the question that appears below (more info):
In the locations menu to the left, what is the sixth country up from the bottom?",,,,,,,,,,1
Oklahoma,Seneca Indian Boarding School,https://www.asylumprojects.org/index.php?title=Seneca_Indian_Boarding_School,,,1872,Active,Cottage Plan,,,"The Wyandotte tribe was removed to this area of Indian Territory (Oklahoma) in 1867. The Society of Friends (Quakers) established a mission in Wyandotte in 1869. The Wyandotte Tribal Council donated land for the Quakers to establish a boarding school for Seneca, Eastern Shawnee and Wyandot, Ottawa, Modoc, Eastern Quapaw, United Peoria, and Western Miami children. Construction of the school began in 1871 and classes began in 1872 with fewer than 50 students. Due to increased pressure after the Federal government took over in 1880, the enrollment increased to more than 135 by 1885.
Other names for the school were Wyandotte Mission, Seneca, Shawnee, and Wyandotte Industrial Boarding School, and Seneca Boarding School. It was supported bu the Quaker Friends' Church until 1880 when it became fully supported by the Federal Government. By the 1920s, the composition of the student body had changed, and was largely Cherokee students. The school had a capacity of 130 students.
The school offered education to children ages 4 - 18, initially offering curriculum through the fourth grade, later expanding to the ninth grade in the 1920's. Unlike the church-sponsored school that failed, the Seneca Indian School ""thrived"" in turning so-called ""savages"" into students; earning it the nickname ""Marvel of the Wilderness."" The boys worked in carpentry, and farm management and maintenance. The girls were taught English cooking, sewing, home management, and grooming.
After the 1880 government take-over, the school is reported to have had strict military discipline and dress reviews, and forbade the speaking of Native languages. The schools superintendent often reported students not returning after Christmas breaks (the only break of the year, a Christian holiday.)
The school had an outbreak of measles and typhoid in 1927, and ""dozens of children"" died.
In 1928, a new principal was appointed, Joe Kagey. The school changed its admittance policy, and was opened to children of all tribes. It became an ""institutional"" school for children coming from situations of hardship. During this period, the school was known for having a successful athletic program in which their teams ranked among the best in the state in football, basketball, baseball, tennis and track. They held an ""Athletic Field Meet"" which included compitition in all sports. In 1952, there were 173 Cherokee students, and a 100 students from other tibes. Kagey retired in 1956.
The school closed on June 15, 1980. The school's 189 acres of land were returned to the Wyandotte Tribe.
Current location of the property is 1 mile south of St Hwy 60 and 12 miles southest of Miami, OK.",1980,"Wyandotte, OK",,,1872,1980,,,235,0
Oklahoma,Chilocco Indian Agricultural School,https://www.asylumprojects.org/index.php?title=Chilocco_Indian_Agricultural_School,,,1883,Closed,Single Building,,Haworth Institute | Chilocco Indian Industrial School | Chilocco Indian Agricultural School | Chilocco Indian School,"Constructed in 1883 and known by various names (Haworth Institute, Chilocco Indian Industrial School, Chilocco Indian Agricultural School, Chilocco Indian School) this federal off-reservation boarding school was established to house, civilize, Christianize, educate, and transform American Indian youth. Thousands of Native children and young adults passed under the school's entryway arch, the architectural marker of ""civilized"" space since Greek and Roman times. In January 1884 Chilocco opened its doors to 150 children from the Cheyenne, Arapaho, Wichita, Comanche, and Pawnee tribes. By 1895 enrollment had increased to 352, and by 1906 students hailed from a wide variety of tribes across Oklahoma and the West. Significant enrollment from the so-called ""Five Civilized Tribes"" did not occur until after 1910, but by 1925 Cherokee constituted the largest single tribal affiliation at the school (26 percent of approximately nine hundred students). As public schools became more accessible to Indian children after World War II, Chilocco served students from more remote, inaccessible areas such as the Navajo reservation in Arizona and New Mexico and communities in Alaska.
Located between Arkansas City, Kansas, to the north and Ponca City, Oklahoma, to the south, Chilocco embodied many roles until its doors were closed in 1980. Home and haven to some, reformatory and prison to others, Chilocco was one of many federal schools designed to dissolve tribal identity and erase indigenous beliefs and practices. Judged by these federal goals, Chilocco both succeeded and failed. In the process, the lives of native people were indelibly altered, and Chilocco alumni, whether they praise or curse its name, will always know themselves as Chiloccoans.
From 1884 until the early 1930s Chilocco operated according to a template devised by U.S. Army officer Richard H. Pratt at Carlisle Indian School in Pennsylvania. The large off-reservation schools used rigorous military discipline and stressed instruction in trades and manual and domestic labor—known as ""actual work."" Alumni from these years remember twenty-two bugle calls a day, government-issue uniforms, scanty meals, inadequate health care, and a paucity of individual attention. They also remember the bonds of loyalty and love that knit students together, and the rivalries of tribe, degree of blood, age, and language difference that cross-cut school society.
In 1928 an exposé of federal Indian Service mismanagement scathingly critiqued conditions in the boarding schools, and in the early 1930s some reforms were introduced. Boys and girls could sit together in the dining rooms, more attention was invested in academic work, and drudgery work devoted to school upkeep was cut back. Nonetheless, many aspects of student life endured: separation from home and family for years at a time, devotion to fellow students, strict discipline, and curricula that remained focused more on vocational than academic preparation.
Through the 1960s and 1970s changing social conditions, growing Native enrollments in public schools, critiques of boarding school conditions, and federal reluctance to fund and operate schools for American Indians (despite treaty and trust obligations) led to the closure of many institutions. Chilocco closed its doors in 1980. At the end of the twentieth century only a few of the flagship off-reservation schools continued to serve Indian youth: Sherman Indian High School in Riverside, California, Chemawa Indian High School in Salem, Oregon, and Chilocco's sister school, Haskell Institute in Lawrence, Kansas, as Haskell Indian Nations University. Since 1989 the Chilocco campus site has been leased to Narconon of Oklahoma, Inc., which operates Chilocco New Life Center, a drug rehabilitation program",,"Wetumpka, Ok",,,1884,1980,,,900,0
Oklahoma,Concho Indian Boarding School,https://www.asylumprojects.org/index.php?title=Concho_Indian_Boarding_School,1909,,1909,Closed,Cottage Plan,,Cheyenne-Arapaho Boarding School at Concho | Concho Demonstration School,"The first school was opened at the Darlington Agency on the Cheyenne-Arapaho Reservation in 1871 by the Hicksite (Liberal) Friends and Orthodox Quakers and was called the Cheyenne-Arapaho Boarding School. In 1872, the facility was built with federal funds, but run by the Quakers. Few Cheyenne children attended the school and as a means to entice them, a partition was erected to divide the classroom into separate areas for the Arapaho and Cheyenne students. In 1879 the facility was renamed the Arapaho Manual Labor and Boarding School and a new facility was built for the Cheyenne students located at Caddo Springs, which was called the Cheyenne Manual Labor and Boarding School. Within 5 years, it was reported that the children at the agency schools were responsible for raising 211 cattle and hogs and cultivating 130 acres of land.
In 1881, a new school, called the Darlington Mission School was built and run by the General Conference Mennonites but a fire which occurred on 19 February 1882 destroyed the building, taking the life of the missionary's infant son and three Indian children. Federal funds and donations from the Mennonite Mission Board were secured to rebuild the mission school by December, 1882. The Mennonites had the same problems as the Quakers had had in trying educating the two tribes together, and opened a fourth school in 1882. called Cantonment. By 1884, the agent reported that attendance in the four schools represented 66 students at the Arapaho boarding school, 22 students at Cantonment, 71 students at the Cheyenne boarding school and 28 students at Darlington.
After 1891 federal policy shifted and began to require more standardization, attendance quotas and less use of federal funds for church ""contracted"" institutions.[11] By the mid 1890s only about half of the school-age children on the Cheyenne-Arapaho Reservation were attending school. An experiment with enrolling Indian children in the public school system and offsetting the costs to the schools was attempted in 1896-1897, but was discontinued. Declining attendance at Darlington forced its permanent closure in June, 1898 and Cantonment closed in 1901. In 1908 both the Arapaho Manual Labor and Boarding School and the Cheyenne Manual Labor and Boarding School were closed and the facilities sold by the government. The Darlington Agency was also closed and relocated to Concho in 1909.
The new school Concho Boarding School opened in 1909[4] and re-implemented the farming model, which continued during the Great Depression. In 1932 the Seger Indian Training School, which had incorporated the students of the Red Moon School in 1917, closed and its students were transferred to Concho. Total Concho Boarding School students for 1932 were 133 boys and 117 girls.However, the school struggled during the Dust Bowl period, where between 1933 and 1937 there were 362 dust storms in the immediate area, coupled with tornadoes and flash flooding. As part of the Works Progress Administration President Franklin D. Roosevelt signed an Executive Order in 1933 which authorized the Indian Service to establish a Civilian Conservation Corps camp at Concho to improve the grounds and buildings, implement soil erosion controls, and develop water resources. The agency buildings were razed and rebuilt in 1933 and a hospital was constructed in 1941.
The era of the federal Indian Termination Policy from the 1940s through the 1960s saw threats to close tribal schools and Concho was not immune. Richard Boynton and George Levi, of the Cheyenne and Arapaho Tribes Business Committee and Robert Goombi of the Kiowa Tribe of Oklahoma sent pleas to Oklahoma Congressmen to fight school closure. The bid to save the school was successful as some of the buildings were converted into a facility to assist troubled students in 1962. In 1968, a new school complex was built for the boarding school, featuring a pioneering teaching program which was to be operated in conjunction with Southwestern State College. The program was designed to overcome language and cultural barriers and offer Indian students access to college materials and individual instruction.
The school was closed after the graduation ceremonies held 14 May 1982 due to federal budget cuts. Though parents and the tribe protested the closure and obtained an injunction to stop it, at the end of the 1983 school term, the school permanently closed. The school buildings were returned to the tribe from the BIA in 1985 for use as business enterprises. In 2015, plans were in the works to convert some of the buildings to a fitness center.
Concho was developed to provide a means of integrating and assimilating American Indian children into mainstream society. It, like other federal boarding schools, was run on a strict military model. Students were wakened at 5 a.m., performed military drills and formations, ate breakfast and were in class by 6:00 each morning. Academic subjects, including reading, writing, and arithmetic, were studied for half the day and the remainder of the day consisted of labor.
Trades and farming were taught to boys and girls were taught domestic labor and nursing. A large experimental farm was maintained, where the children were instructed in conservation and planting techniques. Boys milked cows and girls helped prepare all of the meals and sewed clothing. Discipline was strict and infractions, like speaking in their native language rather than English, were punished by things like breaking large rocks into smaller rocks or sawing wood. Each infraction required punishment of one hour of labor.
Initially, the school offered education to the 6th grade and students would have to transfer to Carlisle, Chilocco or Haskell Institute for secondary education. By around the 1920s, the school curriculum mirrored public education being offered throughout the country and included sports, music, art, and a full course of educational subjects. By the time the school closed in the early 1980s, it offered instruction for grades one - eight and was predominantly attended by orphans and students who had difficult home environments.",1983,"El Reno, OK",,,1909,1983,,,,1
