State,Hospital Name,URL,Established,Construction Began,Opened,Current Status,Building Style,Architect(s),Alternate Names,Raw Text,Closed,Location,Architecture Style,Peak Patient Population,year_opened_LLM,year_closed_LLM,number_of_beds_LLM,number_of_patients_LLM,peak_patient_population_LLM,hand_check_flag_LLM
California,Agnews State Hospital,https://www.asylumprojects.org/index.php?title=Agnews_State_Hospital,,1885.0,1889,Active,Kirkbride Plan,,Agnews Insane Asylum | Agnews Developmental Center,"Today known as the world famous Sun Microsystems/Agnews Developmental Center, the campus-like setting of the former Agnews Insane Asylum consists of a grouping of numerous reinforced concrete, brick, stucco and tile buildings. They are constructed in large rectangular-shaped plans and designed in a Mediterranean Revival style. The buildings are formally placed within a landscaped garden of palms, pepper trees and vast lawns. The treatment of the insane in California dates from the earliest days of the Gold Rush. The first provisions for the insane were to lock them up with criminals in the ship Ephemia, purchased in 1849 by the City of San Francisco, and later to house them at the San Francisco marine hospital in 1850, used primarily for ailing seamen. In 1885 the Agnews Residential Facility was established by the California State Legislature as a neuropsychiatric institution for the care and treatment of the mentally ill. Agnews, opened in 1889, was the third institution in the state established for the mentally ill. Twenty-one years later, the greatest tragedy of the 1906 earthquake in Santa Clara County took place at the old Agnews State Hospital. The multistory, unreinforced masonry building crumbled, killing over 100 patients.
The Institution was then redesigned in, what was then, a revolutionary cottage plan spreading the low-rise buildings along tree-lined streets in a manner that resembled a college campus. The Mediterranean Revival style buildings were constructed of concrete with tile roofs, decorative tile patterns, rustic wooden balconies, porch columns and banisters. Bands of decorative tile patterns reflect the Hispanic influence on the buildings. Now at the center of the Sun Microsystems/Agnews complex is the Clock Tower Building (formerly the Treatment Building) with its massive symmetrical clock tower. The auditorium is an outstanding building, which seems as beautiful today as it was in 1913. Agnews State Hospital was significant as the first modern mental hospital in California, and subsequently other State facilities, followed the example of Agnews. It embodied the distinctive characteristics of a progressive mental hospital in the early 20th century as it was intended to be a ""cheerful"" place with its decentralized specialized buildings for different treatment purposes and different types of patients. Its small, low-scale buildings were designed to bring light and air to patients.
After World War II, new approaches to treatment had an effect on hospital operations and facilities. Among the most important new approaches were the establishment of community clinics, treatment outside of hospitals, and treatment of the developmentally disabled at State Hospitals formerly intended for the mentally ill. A watershed event was the passage of the 1971 Laterman Act, which resulted in closing of several State hospitals and restructuring of the State system. Since that time there has been an increasing move toward closing hospitals and reliance on community treatment programs.
In 1996, the State of California put up for sale 90 acres of the surplus State land (the former site of Agnews Developmental Center). Intense community interest in the future of the site made decisions about the development of the land a challenge. To foster the site's preservation, Agnews Hospital was listed in the National Register of Historic Places for its historic and architectural significance. Sun Microsystems invested $10 million in the restoration of key historic buildings on the property where it built its corporate headquarters, office/research and development space for more than 3,000 employees. This project was a first of its kind; in which a city, community and corporation share, in an interactive way, a work environment and a public environment. Two of the restored historic buildings, the auditorium and the mansion, are available for cultural and social events by community groups on evenings and weekends. Most of the major stands of heritage trees around the historic buildings were preserved and the park-like grounds beautified and maintained for the use of local residents. Local historical groups worked with Sun to refurbish a small local history museum inside the auditorium, the historic Agnews cemetery and a monument to victims of the 1906 earthquake. Smaller residential buildings from the original Agnews Hospital complex are being relocated and will become part of an affordable housing project on another portion of the State surplus land. The site also includes 100+ year-old trees, historically a habitat for the protected species of burrowing owls. Worries about this owl population were overcome when the State agreed to purchase a suitable habitat for the owls and deed it to the California Department of Fish and Game for perpetual management. Both Sun and the City helped to finance the acquisition of this new home for burrowing owls. The auditorium and mansion have been used for many public events since their restoration was completed including performances by the community ballet, chorale, symphony and drum and bugle corps.[1]
In 2014, the Santa Clara Unified School District purchased the property with intent to build three schools on the site. As of May 2024, three schools have been built on the property including an elementary school, middle school, and high school. [2]
Agnews Historic Cemetery & Museum
1250 Hope Drive
Santa Clara, CA 95054
Tel: (408) 615-3790
Fax: (408) 244-8660
Email: Cemetery@santaclaraca.gov
Open by Appointment Only, Call or E-mail for details.
Main Image Gallery: Agnews State Hospital
In the 1906 earthquake, the main treatment building collapsed, crushing 112 residents and staff under a pile of rubble. The victims were buried in a mass grave on the asylum cemetery grounds. The Institution was then redesigned with low-rise buildings that resembled a college campus. According to the information from DDS there are 607 documented burials here from 1889-1906. Burials continued at the hospital through the 1960s.",2009,"Santa Clara, CA",,,1889,,,,,1
California,Atascadero State Hospital,https://www.asylumprojects.org/index.php?title=Atascadero_State_Hospital,1949.0,1951.0,1954,Active,Cottage Plan,,,"Located on California's Central Coast, midway between San Francisco and Los Angeles, Atascadero State Hospital (ASH) is an all-male, maximum security, forensic facility serving the entire state of California. ASH opened in 1954 and is a completely self-contained psychiatric hospital constructed within a security perimeter. ASH has a licensed capacity of 1275 beds, of which 204 are acute/psychiatric and 1071 are intermediate care. All residents at Atascadero State Hospital are male and have a mental disability and pose a threat to others or themselves. The majority are remanded for treatment by the superior courts of the counties of California or by the Department of Corrections pursuant to various sections of the California Penal Code and the Welfare and Institutions Code. Individuals are admitted from state prisons, county jails or are transferred from other state hospitals. The hospital does not accept voluntary admissions.
As a public sector facility, ASH's mission is linked to public policy. ASH has undergone a number of changes due to shifting public, professional, and legislative policy and law regarding the relationship between crime and mental disorders. The hospital's current mission includes the provision of a secure environment that protects the community as well as the people within the hospital, evaluations to the courts and other agencies, and recovery-focused treatment and rehabilitation services.",,"Atascadero, CA",,,1954,,1275,,,0
California,Camarillo State Hospital,https://www.asylumprojects.org/index.php?title=Camarillo_State_Hospital,,1932.0,1936,Closed,Cottage Plan,,"Camarillo State Mental Hospital | California State University, Channel Islands","Camarillo State Mental Hospital, also known as Camarillo State Hospital, was a psychiatric hospital for both developmentally disabled and mentally ill patients in Camarillo, California. The hospital closed in 1997. The site has been redeveloped as the California State University, Channel Islands. The University has retained the distinctive Mission Revival Style architecture, and the distinctive bell tower in the South quad is now the symbol of the university.
In 1932, the State of California purchased 1,760 acres (7.1 km2) of the Lewis ranch, located three miles south of the city of Camarillo, and established the Camarillo State Mental Hospital. Camarillo State Hospital was in use from 1936 to 1997. During its heyday in the 1950s and 1960s, the hospital was at the forefront of treating illnesses that previously had been thought of as untreatable. An example of this was the drug and therapy procedures the facility's doctors developed for schizophrenia. Many of these programs initiated at Camarillo helped patients formerly relegated to a lifetime of warehousing in an institution or lobotomies be able to leave the hospital and move to less restrictive group homes or become (at least nearly) independent. The hospital continued to be a leader in the research of drugs and therapies in subsequent years. They also had one of the first units of any hospital to deal with autism.
Due to its low patient number and the rising costs per patient, the governor of California at the time, Republican Pete Wilson, announced in January 1996 plans to close down the hospital in July 1997. Various members of the community, family members of patients, and employees of Camarillo made several last-ditch efforts to keep the hospital open, arguing in part that the patients are already used to Camarillo and questioned where they would go. Some tried to get mentally ill criminals placed in Camarillo in an effort to save it, a proposal that had come up several times before, but again community members were concerned of the risk of criminals escaping into the community. Pete Wilson ended up standing his ground and the hospital closed down in late June 1997, with the patients and research facilities moved to other locations.
Originally it was intended to turn Camarillo into a prison, but community opposition in part and interest from the Cal State Universities led to its conversion into a university- California State University, Channel Islands (CSUCI). CSUCI had its first classes in fall 2002, four years ahead of the original schedule. Most of the buildings of Camarillo have been preserved and revitalized, including all the original 1930s mission-style buildings. The university is Ventura County's first public university and is quickly becoming a destination university. It had 2,300 students in 2006, but is expected to grow to 15,000 by 2025.
In 1976, a nurse under the name of Nadine Scolla published a diary she had kept while working in Camarillo State Hospital, this set of a chain of events leading to investigations related to the allegations of abuse from the book. The book titled ""Keeper of the Keys"", told of gold fillings pulled out of new patients' mouths and other acts of abuse or by the staff who were often aware and desensitized to the issues going on inside. Due to the nature of the novel, the book was barred from publishing several times and the author was later found dead in her after a home invasion all of this was later detailed in newer editions of the book.
Main Image Gallery: Camarillo State Hospital",1997,,Mission Revival Style,"7,000 in 1957",1936,1997,,,,0
California,Coalinga State Hospital,https://www.asylumprojects.org/index.php?title=Coalinga_State_Hospital,2002.0,,2005,Active,,,,"California’s newest state mental health hospital and the first constructed in more than a half century was dedicated on August 24, 2005. Federal, State, and local dignitaries touted the facility as a leading example for mental health service delivery for challenging populations as well as an economic engine for the Central Valley. The Department of State Hospitals (DSH) - Coalinga began treating forensically committed individuals – mostly sexually violent predators who were transferred from DSH - Atascadero – in early September 2005. Construction was completed on the new state hospital in the summer of 2005. The hospital sits on 320 acres and is comprised of 1.2 million gross square feet of floor space. At full capacity, the facility will house 1,500 individuals and employ approximately 1,600 staff.",,"Coalinga, CA",,,2005,,1500,,,0
California,DeWitt State Hospital,https://www.asylumprojects.org/index.php?title=DeWitt_State_Hospital,,1943.0,1947,Closed,Cottage Plan,,DeWitt General Hospital,"The following information was obtained from Hospital Annual Reports on former DeWitt General Hospital for the years 1943 through 1945. Construction of former DeWitt General Hospital was approved on 25 March 1943, with a tentative completion date set for 15 November 1943. The hospital was activated as Auburn General Hospital on 15 August 1943 per Headquarters, Ninth Service Command General Order 96, dated 12 August 1943. It was designated DeWitt General Hospital per War Department General Order 48, dated 24 August 1943 and confirmed by General Order 122, Headquarters, Ninth Service Command, dated 4 October 1943. DeWitt General Hospital officially opened on 27 February 1944. Its function was ""to receive and treat war casualties as well as those from the Zone of Interior posts, camps, and stations""
The hospital initially furnished general hospital treatment for the Reno Army Air Base, Chico Army Air Field, Camp Beale, Camp Kohler, McClellan Field, and the Sierra Ordnance Depot. With cessation of the war and a large influx of overseas patients, DeWitt General Hospital was relieved of a majority of Zone of Interior patients with the exception of their own duty personnel. DeWitt General Hospital ""was designated a hospital center for the care of neurosurgery, vascular (both medical and surgical), neuropsychiatry (both open and closed ward), general and orthopedic surgery, in addition to general medical type of patients"".
A Dental Branch was present at the hospital as well. In 1944, DeWitt General Hospital was temporarily selected as an amputation center, but the idea was abandoned due to a lack of space and a shortage of equipment and trained personnel. Hospital occupancy peaked on 30 August 1945 with 2,310 patients.
DeWitt General Hospital was declared surplus on 31 December 1945 and the War Assets Administration (WAA) assumed custody of the Site on 24 June 1946. The Site was conveyed to the State of California by quitclaim deed executed on 15 March 1947. As a part of this conveyance four conditions had to be met. According to the first, for a period of 25 years from the date of this conveyance, the property had to be continuously used as and for a mental institution. The second condition stated the premises could not be resold or leased within the first 25 years without authorization from the WAA. The third condition listed the reporting requirements for the state. Finally, the fourth condition was the procedures to be followed if the first three conditions could not be met. The deed states that all and singular tenements, hereditaments, and appurtenances were transferred to the State of California. According to the State Archive's Online Archive of California, the hospital began receiving patients in early 1947.
Initially, DeWitt State Hospital could only receive patients on transfer due to overcrowding in other state mental hospitals. It was equipped to receive both mentally ill and mentally deficient patients. DeWitt State Hospital became a permanent hospital in July 1950, when it began receiving first admissions directly from local communities, including the counties of Modoc, Lassen, Sierra, Yuba, Sutter, Placer, and El Dorado. The hospital had exceeded its rated capacity with over 2,800 patients by 1960, but the number of patients subsequently declined until DeWitt State Hospital was closed in 1972. The federal government deed restrictions expired on 15 March 1972. Correspondence from the Office of Surplus Property Utilization, California Department of Health, Education, and Welfare, stated that upon completion of the 25-year use of the property as a mental institution, it was the intention of the Administration to transfer the property to the County of Placer for further public use, effective 1 April 1972.
Assembly Bill No. 1748, dated 12 April 1972, created the DeWitt Hospital Authority Act to be administered by the Placer County Board of Supervisors. The act made the transfer to the County of Placer, at no cost to the county, in a manner agreeable to the county. If the county ceases to use the property for public purposes, the property will revert to the state. This act was an urgency statute necessary for the immediate preservation of the public peace, health, or safety within the meaning of Article IV of the Constitution, and it went into immediate effect. The act was made necessary because it is imperative in terms of maintenance and operation of expensive machinery and facilities that the machinery and facilities not be allowed to sit idle. During a regular meeting, the Board of Supervisors, County of Placer, State of California, accepted Resolution No: 72-392 on 27 June 1972. By acceptance of this Resolution, the County of Placer consented to the acceptance and recordation of the attached deed, and accepted for public purposes the real property, or interest therein or easements thereon.
Currently, the majority of the Site is known as the DeWitt Government Center. It serves as the primary government center for Placer County. The Placer County Jail and Juvenile Detention Facility are present south of B Avenue and west of Richardson Drive. In addition, several professional services Land surrounding the Site is developed for residential, commercial, and professional use.[1]",1972,,,,1944,1972,,,2310,0
California,Mendocino State Hospital,https://www.asylumprojects.org/index.php?title=Mendocino_State_Hospital,1889.0,1891.0,1893,Preserved,Cottage Plan,,Ukiah State Hospital,"Mendocino State Hospital, originally the Mendocino State Asylum for the Insane, was established in 1889 (Statutes 1889, Ch. 23). By that law the Governor was authorized to appoint a board of directors of five members for a term of four years to select the site and to manage the institution. In October 1890, contracts were let out for the construction of the male ward building, connecting corridor, kitchen building, laundry, bakery, and the boiler and engine house. The contract for these buildings was for $182,520. On the 26th of January, 1891, contracts were let out for the female building for $89,025,. Three months later, in April 1891, construction began on the hospital. Additional funds were allocated for completion of mentioned buildings, including $60,000 for construction of the administration building.
In 1893, the hospital was renamed as the Mendocino Asylum (Statutes 1893, Ch. 64). With the Insanity Law of 1897, the hospital took on the name of Mendocino State Hospital. The Insanity Law created the State Commission on Lunacy which was given authority to see that all laws relating to care and treatment of patients were carried out and to make recommendations to the Legislature concerning the management of hospitals for the insane. The 1897 law provided that each hospital should be controlled by a board of managers of five members appointed by the Governor for four year terms. On December 12 1893, the Hospital was finished and opened to patients, receiving 60 from Napa State Hospital this same day. Two days later 60 more arrived from Stockton State Hospital and on March 25 30 from Agnews State Hospital, bringing the population to 150.
In 1921, the state hospitals were placed under the authority of the newly-created Dept. of Institutions. The board of managers continued, but only with advisory power. The Dept. of Mental Hygiene was created by an act of the Legislature in 1945 (Statutes 1945, Ch. 665). It was given authority over all state mental institutions. Boards of managers were replaced by boards of trustees with no change in function. Advisory boards were established in 1969 to take over the responsibilities of the trustees.
Following the stock market crash in the late 1920s, patient population increased rapidly. By 1932, the hospital had over 1900 patients and 300 employees. By 1935, the figure had risen to over 2600 patients. Hospital population hit a high in 1955 at over 3,000 patients and 700 employees. Increasing discharges and transfer of the criminally insane to the Atascadero facility eased overcrowding. By 1966, population was back under 1800 patients.
Building construction occurred in spurts over the years. The original main building, completed in 1893, was razed in 1952. With the exception of two wards built in 1910 and 1918, the first major construction project took place between 1925-1933. Little construction was accomplished in the 1940s. Between 1950-55, many new major structures were completed to replace old buildings and to provide facilities for new programs.
Major programs over the years have included treatment for the criminally insane (1929-54), alcoholic and drug abuse rehabilitation, a psychiatric residency program, industrial therapy, and others. As part of a major reorganization by the Reagan administration, the hospital was closed in 1972.
The property was sold and its 488-acre grounds were transformed into the City of 10,000 Buddhas, one of the Western Hemisphere’s largest Buddhist communities. The buildings of the former mental hospital remain. Painted in a soft yellow, the warehouse-like structures have been repurposed. They now serve as a temple and monastery, university, dining hall and dorms, elementary and secondary schools, and a bookstore and gift shop.
Main Image Gallery: Mendocino State Hospital",1972,"Ukiah, CA",,"3,000 est. in 1957",1893,1972,,,3000,0
