State,Hospital Name,URL,Established,Construction Began,Opened,Current Status,Building Style,Architect(s),Alternate Names,Raw Text,Closed,Location,Architecture Style,Peak Patient Population,year_opened_LLM,year_closed_LLM,number_of_beds_LLM,number_of_patients_LLM,peak_patient_population_LLM,hand_check_flag_LLM
Oklahoma,Cantonment Indian Boarding School,https://www.asylumprojects.org/index.php?title=Cantonment_Indian_Boarding_School,,,1888,,Single Building,,New Cantonment Indian Boarding School,"The boarding school began in an US army post located on the North Canadian River five miles northwest of present Canton, in Blaine County, OK. (""Cantonment"" is a general term used to identify temporary military fortifications.) Once it was decided the Northern Cheyenne would be removed from Indian Territory, Cantonment was no longer needed by the army, and the military abandoned it in June 1882. The Department of the Interior gained control of Cantonment in 1882 and allowed the Mennonites to operate the station as a school for Indian children. The Interior Department maintained a school at Cantonment beginning in 1898 and in 1903 designated the facility a subagency of the Cheyenne and Arapaho Agency at Darlington.
A newer campus was built by the Mennonite Church during 1888 (when a new building was constructed after complaints by the Cheyenne) upon 3,800 acres of land in rural Oklahoma, this land belonging to the Cheyenne & Arapaho Tribes was reduced to 800 acres by the U.S. Government by 1913. Rev. D. B. Herschler was Superintendent in 1888.
Schooling was conducted 10 months out of the year, with an attendance of 61 pupils on record in March of 1888. Great emphasis was paid to teaching the Christian faith, as well as ""labor with their hands"". Children taught not to hunt or gather, but rather to garden, farm, and take care of stock. Girls were taught kitchen work and sewing instead of weaving. Native languages were banned from use, making English the only acceptable language.
Consumption (or Tuberculosis) seems to also have been a problem at this particular boarding school, with confirmed reports of multiple children dying from the disease on several occasions.
The town of Cantonment was flooded by the State of Oklahoma in 1938 to create a man-made lake, Lake Canton at the cost of $11 million.
Also known as ""New Cantonment"" and ""Cantonment on the North Fork of the Canadian River,"" the site is listed in the National Register of Historic Places (NR 70000527), and has been restored by the Cheyenne-Arapaho Tribes was a reminder.",1927,West shore of Canton Lake,,,1888,1938,,61,,0
Oklahoma,Creating Cherokee Colored Boarding School,https://www.asylumprojects.org/index.php?title=Cherokee_Colored_Boarding_School&action=edit&redlink=1,,,,,,,,"You have followed a link to a page that does not exist yet.
To create the page, start typing in the box below (see the help page for more info).
If you are here by mistake, click your browser's back button.
Warning: You are not logged in. Your IP address will be publicly visible if you make any edits. If you log in or create an account, your edits will be attributed to your username, along with other benefits.
Please note that all contributions to Asylum Projects may be edited, altered, or removed by other contributors.
If you do not want your writing to be edited mercilessly, then do not submit it here.
You are also promising us that you wrote this yourself, or copied it from a public domain or similar free resource (see Asylum Projects:Copyrights for details).
Do not submit copyrighted work without permission!
To edit this page, please answer the question that appears below (more info):
In the locations menu to the left, what is the sixth country up from the bottom?",,,,,,,,,,1
Oklahoma,Cherokee Female & Male Seminary Schools,https://www.asylumprojects.org/index.php?title=Cherokee_Female_%26_Male_Seminary_Schools,,,1851,Closed,Single Building,,,"The Cherokee Male and Female Seminaries were boarding schools opened by the tribal government in 1851. The male school stood southwest of Tahlequah, and its female counterpart north of Park Hill. In identical, three-story, brick structures, the Cherokee Nation offered students a high school education. The preparatory curriculum of the Male Seminary included Greek, Latin, German, and French; chemistry, botany, geology, astronomy, and zoology; geography, U.S. and English history, political economy, and philosophy. While not as rigorous, the Female Seminary's curriculum was academically challenging. Ironically, neither seminary offered instruction in Cherokee language, history, and culture. The year before the schools opened, Cherokee representatives visited New England, seeking teachers. The men and women they employed from Yale, Mount Holyoke, and Newton Theological Seminary became the first of many Eastern-educated teachers who traveled to Indian Territory to teach in the two schools.
Prospective students first must pass a two-day examination, and the successful were educated at tribal expense. Although most students came from affluent, mixed-blood homes, the attrition rate was high in the early years. Twenty-six women and thirteen men were graduated from the seminaries by 1856. By that year the Cherokees had encountered economic problems. Neither seminary accepted students for the 1856 fall semester. The Civil War dashed the tribe's plans to reopen the seminaries. Used as warehouses, hospitals, and even stables, the buildings were in shambles when the war ended. A destitute Cherokee Nation could not reopen its schools until the 1870s. By mid-decade improving financial conditions enabled the Cherokees to renovate both facilities and hire additional teachers.
Because tribal resources were limited, students paid for room and board when the seminaries reopened. Children of tribe members unable to pay could enroll in an indigent department. To attract more students, the seminaries admitted children from other tribes; admission requirements were reduced, and the national council created a primary department composed of grades one through five and a preparatory department encompassing grades six through eight. Oklahoma historian Grant Foreman claimed that ""the Cherokee Nation had a better common school system than either Arkansas or Missouri."" Both institutions attracted dedicated teachers, but Miss A. Florence Wilson, hired as principal teacher in 1875, made a lasting impression in her quarter-century of service. Administering daily doses of sulphur and molasses and presiding over rigorous walks, she enforced discipline with an iron hand.
The educational routine at the Female Seminary was shattered on Easter Sunday in 1887 when fire demolished the building, but Miss Wilson got all the girls out. Two years later the school reopened just north of Tahlequah. Although both schools offered education rarely equaled in the surrounding states, in the years before Oklahoma 1907 statehood federal officials began systematically reducing the authority of tribal government, including its administration of education. Two years after statehood Oklahoma bought the Female Seminary for forty thousand dollars to house a state teacher-training school. The next year the Male Seminary, which was being operated by the tribe as a coeducational facility, burned. Commencement exercises held at Northeastern Normal School in the spring of 1910 honored the last students to earn degrees at the Cherokee National Seminaries.",1910,,,,1851,1910,,,,1
Oklahoma,Absentee Shawnee Boarding School,https://www.asylumprojects.org/index.php?title=Absentee_Shawnee_Boarding_School,,,1893,,,,,"Built near Shawnee, Okla. in 1893.",1899,"Shawnee, OK",,,[1893],[None],[None],[None],[None],1
Oklahoma,Creating Chuala Female Seminary / Pine Ridge Mission School,https://www.asylumprojects.org/index.php?title=Chuala_Female_Seminary_/_Pine_Ridge_Mission_School&action=edit&redlink=1,,,,,,,,"You have followed a link to a page that does not exist yet.
To create the page, start typing in the box below (see the help page for more info).
If you are here by mistake, click your browser's back button.
Warning: You are not logged in. Your IP address will be publicly visible if you make any edits. If you log in or create an account, your edits will be attributed to your username, along with other benefits.
Please note that all contributions to Asylum Projects may be edited, altered, or removed by other contributors.
If you do not want your writing to be edited mercilessly, then do not submit it here.
You are also promising us that you wrote this yourself, or copied it from a public domain or similar free resource (see Asylum Projects:Copyrights for details).
Do not submit copyrighted work without permission!
To edit this page, please answer the question that appears below (more info):
What is the second word in our logo?",,,,,,,,,,1
Oklahoma,Colbert Institute of Perryville,https://www.asylumprojects.org/index.php?title=Colbert_Institute_of_Perryville,,,1854,Active,Cottage Plan,,Collins Institute,"The Colbert Institute, a Methodist boarding school for Chickasaw children, was founded at Perryville in 1854. Rev. John Newton Hamill, Methodist minister, was Superintendent 1858-1860.
Perryville became a strategic outpost in Indian Territory for both sides during the Civil War, and the town saw the Battle of Honey Springs on July 17, 1863 (Civil War). The town was evacuated during the Battle, and some buildings were demolished by artillery fire. Colbert Institute had been entirely burned during the Battle, having been used as a military camp, and was unfit for school purposes.
The town came back after the war, lingered on until well after the railroads had brought coal-rich prosperity to McAlester, a few miles to the north. But now it has virtually disappeared.",,"Perryville, OK",,,[1854],[1863],[None],[None],[None],1
Oklahoma,Collins Institute of Stonewall,https://www.asylumprojects.org/index.php?title=Collins_Institute_of_Stonewall,1854,,1854,,Dormitory Style,,Manual Training School for Chickasaw Boys |  Chickasaw National Academy |  Stonewall Academy |  Old Colbert Institute |  Government School for Chickasaw Girls |  Collins Indian Institute,"After the Civil War the Chickasaw were in need of rebuilding many of their schools that had been demolished or damaged by war. Collins Institute was established largely through the efforts of Rev H Colbert, and Judson Collins, both of whom were prominent members of the Chickasaw Legislature, with the sanction of Governor. The building used as the Superintendent's cottage and the music building, plus 100 acres of land were bought from B Frank Byrd (a prominent Chickasaw and Treasurer of the Nation). During these first 3 years the school was known as a Manual Training School for Chickasaw Boys and maintained 50% by Southern Methodist church and 50% by the Chickasaw Legislature. Before the Civil War the school was known as Colbert Institute and burned. After being rebuilt it became known as the Collins Institute.
At the close of Methodist occupation in 1890, the Institute was taken over fully by the Chickasaw and a boarding school for girls was established. It remained under the Chickasaws until statehood in 1906. During this period Mr A R Waite was named superintendent and the dormitory attendance increased to 45 pupils.
The school offered a girls and a boys basketball team, industrial department, home economics, English, arithmetic, history, botany, music, drawing, Latin, zoology, agriculture, geography, manners, civics. The school taught 1st through 12th grades.
After statehood the school became under Federal control and continued operations as a girls only boarding school for Chickasaw children.
By October 1906 the Federal government had taken full control of the Collins Institute, teaching grades 1st through 12th for Chickasaw girls only. Students were taught English, Algebra, History, Sewing, Botany, Zoology, and Music among other subjects. Girls also played sports as the school had a basketball team - however they had no transportation for the students and therefore the team never played against any other school despite their hopes.",1917,"Stonewall, Ponotoc County, Oklahoma",,,,,,,,1
Oklahoma,Coweta Boarding School,https://www.asylumprojects.org/index.php?title=Coweta_Boarding_School,1843,,1843,Closed,Single Building,,Koweta Boarding School |  Koweta Indian School |  Coweta Indian School |  Coweta Mission School |  Koweta Mission School |  Kowetah Mission School,"The mission was started in 1843 by Presbyterian minister Robert Loughridge at Coweta, then the capital of the Creek Nation, Indian Territory. He named the mission ""Koweta"", after the Creek capital. The Creek had originally resisted Protestant religious missions and their related schools. But in 1842, Robert Loughridge, a Presbyterian missionary, had traveled to Coweta to meet with the Creek Council who gave him permission to open a mission because they wanted their children to have access to an education. Loughridge made the school dependant on the mission. The Council forbid the Rev from preaching anywhere except at his mission.
Writing to the US Indian Agent for the Creek, Rev. Loughbridge states, ""My first object was to build a log house to answer the double purpose of school and church. As soon therefore as it was ready for use, my wife commenced teaching a school of fifteen or twenty children, and the neighbors were invited to attendance at the Mission, while the most of them were devotedly attached to their old customs and superstitions."" He also reported that approx 10 of these boys were living at the mission already. The school operated for 3 months before being temporarily shut down due to spreading illness. In two years time, he reported attendance of both the mission school and his religious services had grown noticeably and he was able to form church services.
At some point, additional buildings were added to the mission to include; girls' dormitory, boys' dormitory, dining room/kitchen, and employee cabins. They also added a smoke-house, mill-house, and horse stable. Education at the school was not only religious but also focused on educating boys in ""all manner of outdoor work"" and educating girls on how to ""be good helpmates for the educated Indian man by performing all manner of indoor work"".
Creek officials granted Loughridge permission to build a second school, which he called Tullahassee Mission. Completed in 1859, it was located 16 miles east of Koweta Mission and 10 miles west of Fort Gibson. Another missionary couple, the Rev. and Mrs. William Robertson, operated this boarding school.
The school flourished until July 10, 1861, when it was suddenly broken up, and all the mission property was taken possession of by the chiefs of the nation. The children were sent home, and teachers left for their homes in the North and South. The Coweta school was never renewed; but at the close of the Civil War, the former teacher, Rev. Robertson was sent with others and revived the school to something of its former size and usefulness in March 1868. The school continued in operation until December 19, 1880, when fire from a flue caught the building on fire and it was burned to the ground.
After the American Civil War broke out, the Presbyterians abandoned the Koweta Mission and left the Territory. It was burned during the war. During the war years, most missionaries abandoned the schools and churches they had started among the tribes, but many children had received some education.",,"Coweta, Wagoner County, OK",,,1843,1880,,,,1
Oklahoma,Darlington Mission School,https://www.asylumprojects.org/index.php?title=Darlington_Mission_School,1880,,1880,,Cottage Plan,,,"Established as the first Mennonite Mission (partly supported by the Federal Gov) in the country, in 1880. The Mission School was founded by German Mennonite missionary Rev. Samuel S. Haury and his wife Susanna. The school building as completed was a large 2-story wood-frame building painted white.
Rev. Haury gave Sunday services to adults and children alike, but these services eventually turned to be all white gatherings, as Haury only spoke English and found preaching through an interpreter ""does not have a sense for the truth and whose life stands in contradiction with the same, & often does more harm than good."" To illustrate his point with the difficulties of the language, Haury gave an example that appeared in the November 1880 issue of the Nachrichten. ""In order to express the word God, they have the word Tschaba Nihaathu (Tschaba = above; Nihaathu = white man) ""the white man above"". The expression is decidedly wrong, as the Indian sees in the white man only his blackmailer and oppressor.""
The main intent of the missionaries was to work with the Arapaho children and through them bring the adults to Christianity; teachings are recorded as having covered Christian idiology, Biblical history, and Sunday School. English was the only language allowed on campus, braids were cut off, and native garb was not allowed.
Then in February of 1882 on the night of the 19th, a very cold and stormy night, the mission building burned down. Four little children, including the Haurys' 9-month old son, Carl, and three half Indian, half white children (Jenny, Walter, and Emil) that the Haurys had taken into their home, died in the fire. The Haurys lost everything. In a special report published by the Nachrichten aus der Heidenwelt Haury wrote, ""What my heart felt with a look at these 4 little corpses and everything that was connected, I am not able to say. One must be led in such depths of sorrow and pain in order to grasp it.""  After the fire the school continued in tents provided by the commander at Fort Reno and proposed that a new building made from bricks should be constructed.
By December 1882, a new brick Mission had been built, ($5000 of the $7000 appropriated by Congress, the remaining $2000 from Mennonite donations) complete with ""kitchen and dining-room in the basement, a school-room and three private rooms on the first, five rooms on the second floor, and two dormitories in the garret."" At this time they had 25 enrolled students; less than they could potentially hold in the new building. They implemented farming lessons for the boys, and kitchen and household lessons for the girls. Children were taught ""the value of money.""
1883 saw the Haurys move to Cantonment (another Mennonite Mission located close by in present Canton, OK) and Albert E. Funk placed in charge at Darlington. The following year Funk transferred to Cantonment and H. R. Voth became the superintendent at Darlington. V. R. Roth and his wife had come to Darlington in 1882 to begin an evening school for adults. Life at the Mission School at this time was praised far and above over childrens' life at one of the Federal Boarding Schools in the area, like the Cheyenne Indian Boarding School & the Arapaho Indian Boarding School.
The mission work continued on for the next several years as it had in the first five. The quarterly reports indicated much sickness among the Indians, frequent loss of interpreters (usually young people who had gone to Carlisle, the Indian industrial school in Pennsylvania, and, after a brief time back in Indian Territory, returned to camp life and were no longer interested in either interpreting, teaching the language to the missionaries, or further Christianization).
In 1887 Voth wrote ""that with the breaking up of the tribal relation of these Indians a great many of their old customs will be discontinued."" This complaint came in response to a return by the Arapaho to their medicine dances which had been on the increase and drawing more and more Natives in the area. In the winter of 1890-1891, the Ghost Dance movement had spread to the Arapaho in Indian Territory and the result for the Mennonite missionaries was fewer children in attendance at their schools. Whereas the Darlington school had been running at or near capacity with between 45-50 students, in the fall of 1890, there were only thirty-five. Finally in June of 1888 the Mennonite mission had baptized its first convert to Christianity; a young girl, 17 year old Maggie Leonard.
In his 1891 third quarter report, Voth noted that much more effort and money was being placed into the government schools than had been previously. The Arapaho government school was to be improved and a large government school erected within the Seger Colony. Obtaining and keeping students had become increasingly difficult since 1887, and the ""Rules in Regard to Attendance of Indian Youth at School"" passed by Congress in the Indian Appropriation Act of March 3, 1891 and printed in the 1891 Commissioner's report began to effect the small Darlington School. ""The chief cause of this difficulty seems to be, that the government schools at Darlington have both been greatly enlarged and that the government officials, as is quite natural, endeavor to have these filled with pupils first. The consequence is, that a portion of our former pupils have been persuaded to attend the government school instead of coming back to our mission school."" wrote J. S. Krehbiel, the superintendent.
When in 1892 the number of pupils for the Darlington school was so small that the school didn't open, the Mission Board considered several options, including: a) an orphanage; b) a hospital; c) a home for older Indian boys and girls who have returned from school in order to assist them in establishing themselves in life; d) to take Negro children into the school. The last named plan seemed for a while the most practicable but finally the Government would not consent to the change and so this plan must be abandoned the idea of converting the school building into a hospital for sick and disabled Indians was carried out only in limited fashion to the extent that a room was arranged and furnished and a man appointed to care for sick Indians.
In 1893 the Darlington school opened again but with only 14 students the following year, the numbers were almost double, up to an average attendance of 27 students. But the government continued to decrease the amount of money appropriated for schools under private control. Reports for spring 1894 tell much the same story. Twenty pupils were enrolled, although only fourteen were present. Three of the absent students were ill.
BY 1897 Government monetary and ration support had completely ceased, and the new superintendent Edward H. Haury wrote ""it seems difficult to continue the mission school in Darlington, and considering that the results attained through the school there seem to be out of proportion with the cost and the work required.""
In June 1898 the school at Darlington was closed and never again reopened. In November 1898, A. B. Shelly, editor of the Mission Department of The Mennonite and Secretary of the Mission Board wrote an editorial entitled, Our Indian Mission—Its Present Needs, in which he said:
""Not unfrequently the Missionboard has been hampered in its work on account of an insufficient number of workers. It was on this account mainly that the Board felt itself obliged to discontinue the school at Darlington. And although the Board has decided to retain the station as a mission station, by stationing a missionary there, it has thus far been unable to find the proper person for that position. Should our efforts in this direction prove as unavailing in the future as they have in the past, the Board will no doubt be obliged, against its will, to relinguish this station entirely.""
The Darlington site has had a cherished history since it's closing in 1898. In 1909 it became a Masonic home, of which the 1913 chapel still remains; in 1923 it was taken over by the Oklahoma Narcotics Institution; and the Oklahoma Wildlife Dept. operated it from 1932-1996. It is now the Ag. Ed. and Applied Science building in the Darlington School District in El Reno, Oklahoma.",1898,"Darlington, OK (near present El Reno, OK)",,,1880,1898,,,,1
Oklahoma,Creating Eufaula Boarding School,https://www.asylumprojects.org/index.php?title=Eufaula_Boarding_School&action=edit&redlink=1,,,,,,,,"You have followed a link to a page that does not exist yet.
To create the page, start typing in the box below (see the help page for more info).
If you are here by mistake, click your browser's back button.
Warning: You are not logged in. Your IP address will be publicly visible if you make any edits. If you log in or create an account, your edits will be attributed to your username, along with other benefits.
Please note that all contributions to Asylum Projects may be edited, altered, or removed by other contributors.
If you do not want your writing to be edited mercilessly, then do not submit it here.
You are also promising us that you wrote this yourself, or copied it from a public domain or similar free resource (see Asylum Projects:Copyrights for details).
Do not submit copyrighted work without permission!
To edit this page, please answer the question that appears below (more info):
In the toolbox menu to the left what is the second word in the third link from top?",,,,,,,,,,1
